#CODE;ENGLISH;FRENCH;GERMAN;;SPANISH;;;;;;;;;x
###### Modifiers;;;;;;;;;;;;;;x
luxor_admin;Luxor Administrative Offices;Bureaux administratifs de Louxor;Luxor Administrative Offices;;Luxor Administrative Offices;;;;;;;;;x
luxor_fanaticism;Fanatic Shrine;Sanctuaire fanatique;Fanatic Shrine;;Fanatic Shrine;;;;;;;;;x
luxor_library;Luxor Library;Bibliothèque de Louxor;Luxor Library;;Luxor Library;;;;;;;;;x
luxor_restored;Luxor Restored;Louxor Restauré;Luxor Restored;;Luxor Restored;;;;;;;;;x
held_sed_festival;Held a Sed festival;A tenu une fête de Sed;;;;;;;;;;;;x
held_failed_sed_festival;Held a failed Sed festival;A tenu une fête de Sed réussite;;;;;;;;;;;;x
held_sed_festival_timer;Held a Sed festival;A tenu un fête de Sed;;;;;;;;;;;;;x
akhetaten_restored;Akhetaten is Restored;Akhetaton est restauré;;;;;;;;;;;;x
akhetaten_admin;Administrative Offices;Bureaux administratifs;;;;;;;;;;;;x
akhetaten_fanaticism;Fanatacism;Fanatisme;;;;;;;;;;;;x
akhetaten_library;Great Library;Grande bibliothèque;;;;;;;;;;;;x
###### Decisions;;;;;;;;;;;;;;x
restore_luxor;Restore Luxor Temple;Restaurer le Temple de Louxor;Restore Luxor Temple;;Restore Luxor Temple;;;;;;;;;x
restore_luxor_desc;Restore Luxor Temple to its former glory.;Restaurer le Temple de Louxor à la hauteur de son lustre d'antan.;Restore Luxor Temple to its former glory.;;Restore Luxor Temple to its former glory.;;;;;;;;;x
restore_priesthood_egyptian_pagan;Restore the Paragon Xroj;Restaurer le Parangon Xroj;Restore the Paragon Xroj;;Restore the Paragon Xroj;;;;;;;;;x
restore_priesthood_egyptian_pagan_desc;Restore the Paragon Xroj.;Restaurer le Parangon Xroj;Restore the Paragon Xroj;;Restore the Paragon Xroj;;;;;;;;;x
luxor_restored_condition;The temple of Luxor is restored;Le temple de Louxor est restauré;;;;;;;;;;;;x
build_pyramid;Build a Pyramid;Construire une pyramide;Build a Pyramid;;Build a Pyramid;;;;;;;;;x
build_pyramid_desc;Build yourself a mighty tomb;Vous vous construisez une tombe majestueuse.;Build yourself a mighty tomb;;Build yourself a mighty tomb;;;;;;;;;x
organize_anubis;Organize the Anubis Guard;Organiser la Garde d'Anubis;Organize the Anubis Guard;;Organize the Anubis Guard;;;;;;;;;x
organize_anubis_desc;Organize the Anubis Guard Holy Order;Organiser l'Ordre Saint de la Garde d'Anubis;Organize the Anubis Guard Holy Order;;Organize the Anubis Guard Holy Order;;;;;;;;;x
organize_horus;Organize the Horusian Guard;Organiser la Garde d'Horus;Organize the Horusian Guard;;Organize the Horusian Guard;;;;;;;;;x
organize_horus_desc;Organize the Horusian Guard Holy Order;Organiser l'Ordre Saint de la Garde d'Horus.;Organize the Horusian Guard Holy Order;;Organize the Horusian Guard Holy Order;;;;;;;;;x
hold_sed_festival;Hold a Sed Festival;Organiser une fête de Sed;Hold a Sed Festival;;Hold a Sed Festival;;;;;;;;;x
hold_sed_festival_desc;Traditionally, after 30 years of rule and every 3 years after that, a Pharaoh holds a festival to celebrate his continuous success, renew his royal powers and rejuvenate his strength.;Traditionnellement, après 30 ans de règne et tous les trois ans après cela, un Pharaon organise un festival pour célébrer son succès continu, renouveler ses pouvoirs royaux et rajeunir sa force.;;;;;;;;;;;;x
organize_burning_blades;Organize the Burning Blades;Organiser les Lames Brûlantes;;;;;;;;;;;;x
organize_burning_blades_desc;Organize the Burning Blades Holy Order;Organiser les Lames Brûlantes;;;;;;;;;;;;x
restore_priesthood_aten_pagan;Restore the Priesthood of Aten;Restaurer le Sacerdoce d'Aton;;;;;;;;;;;;
restore_priesthood_aten_pagan_desc;Establish yourself as the Meryaten, highest priest of the Aten faith, and living god!;Établissez vous même, en tant que Meryaten, prêtre suprême de la foi d'Aton et dieu vivant !;;;;;;;;;;;;x
akhetaten_restored_condition;The temple of Akhenaten is restored;Le temple d'Akhenaton est restauré;;;;;;;;;;;;x
restore_akhetaten;Restore Akhetaten;Restaurer Akhetaton;;;;;;;;;;;;x
restore_akhetaten_desc;Restore the ancient center of Aten's worship, Akhetaten.;Restaurer l'ancien centre de Aton, Akhetaton.;;;;;;;;;;;;x
###### Events;;;;;;;;;;;;;;x
egyptian.0.title;The Restoration of Luxor Temple;La restauration du Temple de Louxor;The Restoration of Luxor Temple;;The Restoration of Luxor Temple;;;;;;;;;x
egyptian.0.desc;Much time has passed since Luxor Temple’s last official use and the peasantry has moved into its location since then. A sad sight it is indeed to see it in its current status. You decide that it is in the best interest of everyone to restore this temple to its former glory and make it a beacon of a revitalized Kemetic religion.;Bien du temps a passé depuis le dernier usage officiel du Temple de Louxor et la paysannerie s'est installée dans ses lieux depuis. C'est en effet une bien triste vision que le temple dans son état actuel. Vous décidez que c'est dans l'intérêt général de restaurer ce temple dans sa gloire d'antan et d'en faire le symbole d'une religion kémite revigorée.;Much time has passed since Luxor Temple’s last official use and the peasantry has moved into its location since then. A sad sight it is indeed to see it in its current status. You decide that it is in the best interest of everyone to restore this temple to its former glory and make it a beacon of a revitalized Kemetic religion.;;Much time has passed since Luxor Temple’s last official use and the peasantry has moved into its location since then. A sad sight it is indeed to see it in its current status. You decide that it is in the best interest of everyone to restore this temple to its former glory and make it a beacon of a revitalized Kemetic religion.;;;;;;;;;x
egyptian.0.a;Make it the greatest temple there ever was!;Faites-en le plus grand temple jamais construit !;Make it the greatest temple there ever was!;;Make it the greatest temple there ever was!;;;;;;;;;x
egyptian.1.title;New Wing;Nouvelle aile;New Wing;;New Wing;;;;;;;;;x
egyptian.1.desc;The restoration of Luxor Temple is nearly complete and your chief architect inquires if you would like to add a new wing to the temple.;La restauration du Temple de Louxor est presque achevée et votre architecte en chef vous demande si vous aimeriez ajouter une nouvelle aile au temple.;The restoration of Luxor Temple is nearly complete and your chief architect inquires if you’d like to add a new wing to the temple.;;The restoration of Louxor Temple is nearly complete and your chief architect inquires if you’d like to add a new wing to the temple.;;;;;;;;;x
egyptian.1.a;Build a grand library.;Construisez une grande bibliothèque.;Build a grand library.;;Build a grand library.;;;;;;;;;x
egyptian.1.b;Build a shrine for fanatics.;Construire un sanctuaire pour les fanatiques.;Build a shrine for fanatics.;;Build a shrine for fanatics.;;;;;;;;;x
egyptian.1.c;Build administrative offices.;Construire des bureaux administratifs.;Build administrative offices.;;Build administrative offices.;;;;;;;;;x
egyptian.2.title;Luxor Temple Restored;Temple de Louxor Restauré;Luxor Temple Restored;;Luxor Temple Restored;;;;;;;;;x
egyptian.2.desc;The temple has finally been restored to its former glory.;Le temple a enfin été restauré à la hauteur de sa splendeur d'antan.;The temple has finally been restored to its former glory.;;The temple has finally been restored to its former glory.;;;;;;;;;x
egyptian.2.a;Excellent;Excellent;Excellent;;Excellent;;;;;;;;;x
egyptian.3.title;The Luxor Temple Restored!;Le Temple de Louxor est restauré !;The Luxor Temple Restored!;;The Luxor Temple Restored!;;;;;;;;;x
egyptian.3.desc;It would seem that the Egyptians have been very busy recently. A recent resurgence of Kemetic fanaticism has swept Egypt and the pinnacle of their fanaticism has been reached with the restoration of Luxor Temple. Located on the east bank of the Nile, this temple is both splendid to withhold and enormous in size. It even holds an entirely new wing, attached to the groundwork of the original temple.;Il semblerait que les Égyptiens aient été actifs ces derniers temps. L'Égypte a été prise récemment par une recrudescence du fanatisme kémite et le summum de leur fanatisme a été atteint avec la restauration du Temple de Louxor. Situé sur la rive est du Nil, ce temple est à la fois d'une beauté à couper le souffle et d'une taille gigantesque. Il abrite même une nouvelle aile, attenante aux fondations du temple d'origine.;It would seem that the Egyptians have been very busy recently. A recent resurgence of Kemetic fanaticism has swept Egypt and the pinnacle of their fanaticism has been reached with the restoration of Luxor Temple. Located on the east bank of the Nile, this temple is both splendid to withhold and enormous in size. It even holds an entirely new wing, attached to the groundwork of the original temple.;;It would seem that the Egyptians have been very busy recently. A recent resurgence of Kemetic fanaticism has swept Egypt and the pinnacle of their fanaticism has been reached with the restoration of Luxor Temple. Located on the east bank of the Nile, this temple is both splendid to withhold and enormous in size. It even holds an entirely new wing, attached to the groundwork of the original temple.;;;;;;;;;x
egyptian.3.a;Worrying...;Inquiétant...;Worrying...;;Worrying...;;;;;;;;;x
egyptian.4.desc;The pharaohs of ancient times would often have massive tombs erected in their honour during their reign. Such effort was put into the construction of these pyramids that often decades would go by before being completed and the pharaoh who commissioned the pyramid would already be long dead. Regardless, it was seen as a very prestigious and important thing to do as a pharaoh.;Les pharaons des temps anciens érigeaient souvent d'imposantes tombes en leur honneur pendant leur règne. La construction de ces pyramides représentait un labeur si titanesque que des décennies étaient souvent nécessaires pour les construire et les pharaons qui en avoient lancé la construction étaient défunts depuis longtemps. Quoi qu'il en soit, c'était considéré une besogne très prestigieuse et importante à accomplir pour un pharaon.;The pharaohs of ancient times would often have massive tombs erected in their honour during their reign. Such effort was put into the construction of these pyramids that often decades would go by before being completed and the pharaoh who commissioned the pyramid would already be long dead. Regardless, it was seen as a very prestigious and important thing to do as a pharaoh.;;The pharaohs of ancient times would often have massive tombs erected in their honour during their reign. Such effort was put into the construction of these pyramids that often decades would go by before being completed and the pharaoh who commissioned the pyramid would already be long dead. Regardless, it was seen as a very prestigious and important thing to do as a pharaoh.;;;;;;;;;x
egyptian.4.a;Tradition drives me to do it;La tradition me pousse à le faire;Tradition drives me to do it;;Tradition drives me to do it;;;;;;;;;x
egyptian.5.desc;Over a decade has passed since the construction of this pyramid began. Over a hundred thousand workers toiled during this period, often times giving their very lives in order to honor their sacred pharaoh. One cannot deny the sheer impressiveness of this structure.;Plus d'une décennie s'est écoulée depuis le début de la construction de cette pyramide. Pendant cette période, plus de cent mille ouvriers ont travaillé dur sur ce projet, souvent en donnant leur propre vie afin d'honorer leur pharaon sacré. On ne peut nier la pure magnificence de ce bâtiment.;Over a decade has passed since the construction of this pyramid began. Over a hundred thousand workers toiled during this period, often times giving their very lives in order to honour their sacred pharaoh. One cannot deny the sheer impressiveness of this structure.;;Over a decade has passed since the construction of this pyramid began. Over a hundred thousand workers toiled during this period, often times giving their very lives in order to honour their sacred pharaoh. One cannot deny the sheer impressiveness of this structure.;;;;;;;;;x
egyptian.5.a;My pyramid will last for millennia!;Ma pyramide tiendra des millénaires !;My pyramid will last millenia!;;My pyramid will last millenia!;;;;;;;;;x
egyptian.5.b;A fine sight, hopefully my pyramid will be even better;Une belle vue, j'espère que ma pyramide sera encor meilleure;A fine sight, hopefully my pyramid will be even better;;A fine sight, hopefully my pyramid will be even better;;;;;;;;;x
egyptian.5.c;I was wondering what happened to all my workers...;Je me demandais ce qui est advenu de tous mes ouvriers...;I was wondering what happened to all my workers...;;I was wondering what happened to all my workers...;;;;;;;;;x
egyptian.6.title;The Rise of Amun-ra;L'ascension d'Amon-ra;The Rise of Amun-ra;;The Rise of Amun-ra;;;;;;;;;x
egyptian.6.desc;Long has it been that Kemetism was a majority in the lands of Egypt. No longer shall false prophets of moon and sickle sway the hearts and minds of the Egyptian people. The High Priesthood of Kemetism has been restored, and a so called Paragon Xroj shall now take of the administration of the lower Priesthood, all under the guidance of a mighty Pharaoh.;Cela faisait longtemps que le Kémitisme n'était plus majoritaire sur les terres d'Égypte. Plus jamais les faux prophètes de la lune et de la faucille n'influenceront les cœurs et les esprits du peuple égyptien. Le Haut Sacerdoce du Kémitisme a été restauré, et un dénommé Parangon Xroj se chargera désormais de l'administration des rangs inférieurs du clergé, le tout sous la direction d'un puissant Pharaon.;Long has it been that Kemetism was a majority in the lands of Egypt. No longer shall false prophets of moon and sickle sway the hearts and minds of the Egyptian people. The High Priesthood of Kemetism has been restored, and a so-called Paragon Xroj shall now take of the administration of the lower Priesthood, all under the guidance of a mighty Pharaoh.;;Long has it been that Kemetism was a majority in the lands of Egypt. No longer shall false prophets of moon and sickle sway the hearts and minds of the Egyptian people. The High Priesthood of Kemetism has been restored, and a so-called Paragon Xroj shall now take of the administration of the lower Priesthood, all under the guidance of a mighty Pharaoh.;;;;;;;;;x
egyptian.6.a;Fantastic!;Fantastique !;Fantastic!;;Fantastic!;;;;;;;;;x
egyptian.6.b;Unexpected...;Inattendu...;Unexpected...;;Unexpected...;;;;;;;;;x
egyptian.7.title;Warriors of Death;Les Guerriers de la Mort;Warriors of Death;;Warriors of Death;;;;;;;;;x
egyptian.7.desc;Word has it that the enemies of Egypt have something new to fear. Warriors atop chariots equipped with bow and arrow alongside fearsome spear troops. Some even whisper that they don helmets in the shape of the old god, Anubis. Regardless of such claims, this new Kemetic holy order will pose a serious threat to all that oppose Kemetism.;À ce qu'on dit, les ennemis de l'Égypte ont une nouvelle raison de la craindre. Des guerriers embarqués dans des chars et équipés d'un arc et de flèches, aulx cotés de redoutables piquiers. Certains murmurent même qu'ils revêtent des casques de la forme d'un dieu ancien, Anubis. Quelle que soit la véracité de ces allégations, ce nouvel ordre saint kémite posera une sérieuse menace à tous ceux qui s'opposent au Kémitisme.;Word has it that the enemies of Egypt have something new to fear. Warriors atop chariots equipped with bow and arrow alongside fearsome spear troops. Some even whisper that they don helmets in the shape of the old god, Anubis. Regardless of such claims, this new Kemetic holy order will pose a serious threat to all that oppose Kemetism.;;Word has it that the enemies of Egypt have something new to fear. Warriors atop chariots equipped with bow and arrow alongside fearsome spear troops. Some even whisper that they don helmets in the shape of the old god, Anubis. Regardless of such claims, this new Kemetic holy order will pose a serious threat to all that oppose Kemetism.;;;;;;;;;x
egyptian.7.a;Worrisome...;Inquiétant...;Worrisome...;;Worrisome...;;;;;;;;;x
egyptian.8.title;The Horus Guard;La Garde d'Horus;The Horus Guard;;The Horus Guard;;;;;;;;;x
egyptian.8.desc;With the ongoing success of the Anubis guard, yet another Kemetic holy order has been organized. The Horusian Guard is ready to defend the Egyptian empire from all heathens and heretics that would dare threaten it. Only a fool would attack the Egyptians head on now.;Avec le succès en cours de la garde d'Anubis, un nouvel ordre saint kémite a été créé. La garde d'Horus est prêt à défendre l'empire égyptien contre tous les païens et tous les hérétiques qui oseraient le menacer. Seul un fou attaquerait de front les Égyptiens à présent.;With the ongoing success of the Anubis guard, yet another Kemetic holy order has been organized. The Horusian Guard is ready to defend the Egyptian empire from all heathens and heretics that would dare threaten it. Only a fool would attack the Egyptians head on now.;;With the ongoing success of the Anubis guard, yet another Kemetic holy order has been organized. The Horusian Guard is ready to defend the Egyptian empire from all heathens and heretics that would dare threaten it. Only a fool would attack the Egyptians head on now.;;;;;;;;;x
egyptian.8.a;Worrisome...;Inquiétant...;Worrisome...;;Worrisome...;;;;;;;;;x
###### Sed festival;;;;;;;;;;;;;;
egyptian.10.desc;On the first day of the festival, you present offerings to the gods. Then, while seated and crowned on a raised platform, the priests carry the statues of the gods and present offerings, in a sign of giving thanks for past loyalty and to secure good relationships in the future.;Le premier jour du festival, vous présentez des offrandes aux dieux. Alors, assis et couronné sur une plate-forme surélevée, les prêtres portent les statues des dieux et présentent des offrandes, en signe de remerciement pour la fidélité passée et pour assurer de bonnes relations dans le futur.;;;;;;;;;;;;x
egyptian.10.a;This is good to be the Pharaoh !;C'est bon d'être le Pharaon !;;;;;;;;;;;;x
egyptian.11.desc;On the second day, attired with a short kilt with a bull's tail in its back, you prepare yourself to run the ritual race alongside the Apis Bull. The course is bounded by two points symbolizing the borders of the realm, to reinforce your dominion over the whole kingdom.;Le deuxième jour, vêtu d'une jupe avec une queue de taureau dans le dos, vous vous préparez à exécuter la course rituelle aux côtés d'Apis. Le parcours est délimité par deux points symbolisant les frontières du royaume, pour renforcer votre domination sur tout le royaume.;;;;;;;;;;;;
egyptian.11.a;I dedicate the race to the gods !;Je dédie la course aux dieux !;;;;;;;;;;;;x
egyptian.12.desc;On the last day, you are carried in a procession to visit the chapels of the gods. At the chapel of Horus, you receive the crook and the flail. At the two chapels of Horus and Seth, you are handed a bow and arrow, to shoot an arrow in each one of the four directions.;Le dernier jour, vous êtes porté en procession pour visiter les chapelles des dieux. À la chapelle d'Horus, vous recevez le crochet et le fouet. Aux deux chapelles d'Horus et de Seth, on vous remet un arc et une flèche pour tirer une flèche dans chacune des quatre directions.;;;;;;;;;;;;
egyptian.12.a;Praise the gods !;Louons les dieux !;;;;;;;;;;;;x
egyptian.13.desc;The festival was a great success. I've proved that I was still physically able to rule the country, and I feel rejuvenated and reborn.;Le festival a été un grand succès. J'ai prouvé que j'étais encore capable de dominer le pays, et je me sens rajeuni et renoué.;;;;;;;;;;;;x
egyptian.13.a;I shall organize another one in three years !;J'en organiserai un autre sur trois ans !;;;;;;;;;;;;x
egyptian.14.desc;The afternoon is getting hot, and it seems as if the procession of priests would never end. You start loosing attention to them, and slowly fall asleep in your throne... Soon the high priests realize what is happening, and are outraged !;L'après-midi devient chaud, et il semble que la procession des prêtres ne finisse jamais. Vous commencez à perdre l'attention sur eux, et vous vous endormez sur votre trône ... Bientôt, les grands prêtres se rendent compte ce qui se passe, et sont indignés !;;;;;;;;;;;;x
egyptian.14.a;Must be something from the food...;Oui, oui, la nourriture, tout ça ...;;;;;;;;;;;;x
egyptian.15.desc;The race is not going well, you're exhausted, and suddenly you feel the sand falling from under your feet. Seconds after you're on the ground, grasping for your breath, and unable to complete the race.;La course ne va pas bien, vous êtes épuisé, et tout à coup, vous sentez que le sable tombe sous vos pieds. Quelques secondes après que vous êtes sur le terrain, saisissant votre souffle et incapable de compléter la course.;;;;;;;;;;;;x
egyptian.15.a;The terrain was too heavy...;C'est trop dure ...;;;;;;;;;;;;x
egyptian.16.desc;You hear a scream and the noise of something falling down. The crowd opens up and you realize that you've hit someone with an arrow !;Vous entendez un cri et le bruit de quelque chose tomber. La foule s'ouvre et vous vous rendez compte que vous avez frappé quelqu'un avec une flèche !;;;;;;;;;;;;x
egyptian.16.a;The bow's aim must have been flawed...;La cible de l'arc doit être endommagé ...;;;;;;;;;;;;x
egyptian.17.desc;Due to the incident, the festival could not be completed properly. I've failed to honor the gods according to tradition, and people all over the realm will soon be laughing when they hear about it...;En raison de l'incident, le festival n'a pas pu être fait correctement. Je n'ai pas réussi à honorer les dieux selon la tradition, et tout le monde risqueront bientôt d'en entendre parler ...;;;;;;;;;;;;x
egyptian.17.a;Maybe I'm no longer trusted by the Gods...;Peut-être que les dieux ne me font plus confiance ...;;;;;;;;;;;;x
egyptian.17.b;Who cares? This is a stupid tradition anyway.;On s'en fout ? C'est une tradition stupide de toute façon.;;;;;;;;;;;;x
egyptian.17.c;I'll make sure someone gets punished for this.;Je ferai en sorte que quelqu'un soit puni pour cela.;;;;;;;;;;;;x
egyptian.200.desc;A sandstorm has caught you and the other travellers unawares. It's all you can do to keep your eyes from being scraped from their sockets by the sand.\nAfter what seems like hours, you realize that you have lost your traveling companions!;Une tempête de sable vous a surpris et les autres voyageurs. Tout ce que vous pouvez faire est d'éviter que vos yeux ne soient raclés de leurs prises par le sable.\nAprès ce qui semblait être des heures, vous vous rendez compte que vous avez perdu vos compagnons de voyage !;;;;;;;;;;;;x
egyptian.200.a;May [Root.Religion.GetRandomGodName] guide me to safety...;Que [Root.Religion.GetRandomGodName] m'amène en sécurité ...;;;;;;;;;;;;x
egyptian.201.desc;As you wander across the dunes through the blowing winds, you see a dark shape to your right. It looks like it could be a building, but then again, it may just be a boulder...;Lorsque vous traversez les dunes à travers les vents soufflants, vous voyez une forme sombre à votre droite. On dirait qu'il pourrait s'agir d'un bâtiment, mais encore une fois, il se peut que ce soit un rocher ...;;;;;;;;;;;;x
egyptian.201.a;What fortune!;Quelle chance !;;;;;;;;;;;;x
egyptian.201.a.tt;You move toward the shadow...;Vous vous déplacez vers l'ombre ...;;;;;;;;;;;;x
egyptian.202.desc;As you approach the shadowy form it looms large before you. The wind and sand give way, revealing the shadow to be an old temple, it's statues worn of detail from centuries of sandstorms. And yet, you feel a presence with the ancient stones.\nThe light is failing and the air grows chill. Will you push on through the night to find the path, or take shelter within?;Au fur et à mesure que vous vous approchez de la forme obscure, elle occupe une place importante devant vous. Le vent et le sable cédèrent, révélant l'ombre comme un vieux temple, ce sont des statues de détails de siècles de tempêtes de sable. Et pourtant, vous ressentez une présence avec les pierres anciennes.\nLe soleil se couche et l'air se refroidit. Poursuivrez-vous dans la nuit pour trouver votre chemin ou restez-vous à l'abri ?;;;;;;;;;;;;x
egyptian.202.a;This place chills my bones, I will not stay within it's walls.;Cet endroit refroidit mes os, je ne resterai pas au sein de ses murs.;;;;;;;;;;;;x
egyptian.202.a.tt;You will brave the sands to find your way.;Vous affronterez les sables pour trouver votre chemin.;;;;;;;;;;;;x
egyptian.202.b;I fear no ancient stones.;Je ne crains pas de pierres anciennes.;;;;;;;;;;;;x
egyptian.202.b.tt;You enter the old temple.;Vous entrez dans l'ancien temple.;;;;;;;;;;;;x
egyptian.203.desc;As you approach the shadowy form it looms large before you. The wind and sand give way, revealing the shadow to be a weathered but sturdy inn on the pilgrim's road. You've found your way back!;Au fur et à mesure que vous vous approchez de la forme obscure, elle occupe une place importante devant vous. Le vent et le sable cédèrent, révélant l'ombre comme une auberge résistante mais résistante sur la route du pèlerin. Vous avez retrouvé votre chemin !;;;;;;;;;;;;x
egyptian.203.a;Thanks to [Root.Religion.GetRandomGodName]!;Merci [Root.Religion.GetRandomGodName] !;;;;;;;;;;;;x
