#CODE;ENGLISH;FRENCH;GERMAN;;SPANISH;;;;;;;;;x
egyptian.204.desc;The interior is in remarkable condition. Statues line the chamber and braziers light their strange forms. Some look human, others bear animal heads. You are enraptured by one of a green man with a white disk crown when you hear an old man's voice behind you. "Thanking Khonsu for guiding you to safety, I see. He does appreciate gratitude," the man chuckles as he shoulders his pack to the floor.;L'intérieur est dans un état remarquable. Les statues devant la chambre et les brasseurs éclairent leurs formes étranges. Certains semblent humains, d'autres portent des têtes d'animaux. Vous êtes ravis d'un homme vert avec une couronne de disque blanc lorsque vous entendez la voix d'un vieillard derrière vous. "Merci à Khonsu de vous guider vers la sécurité, je vois. Il apprécie la gratitude", dit l'homme se mettant à glousser.;;;;;;;;;;;;x
egyptian.204.a;Khon-who?;Khon-qui ?;;;;;;;;;;;;x
egyptian.204.a.tt;You wait out the storm with the man.;Vous attendez que la tempête passe avec l'homme.;;;;;;;;;;;;x
egyptian.205.desc;As the night wears on the old man reveals that he is a member of a nomadic tribe. One that still worships the old gods of Egypt. In fact, his tribe is but one of many...;Durant la nuit, le vieil homme révèle qu'il est membre d'une tribu nomade. Celui qui continue à adorer les anciens dieux égyptiens. En fait, sa tribu n'est que l'une des nombreuses ...;;;;;;;;;;;;x
egyptian.205.a;Interesting...;Intéressant ...;;;;;;;;;;;;x
egyptian.205.a.tt;You continue to listen to the old man.;Vous continuez à écouter le vieil homme.;;;;;;;;;;;;x
egyptian.206.desc;"I think Set may have had a hand in bringing you here as well. The desert obeys him, you see. If Set wanted you here, and Khonsu made sure your passage was safe, you can be sure it was the will of Amun that you be here. Only he could get those two to work together!" The old man laughs at this.\n"[Root.GetFirstName], I believe you were meant to be here, now, with me! If you wish it, I can teach you the ways of the gods. The federation my tribe belongs to would follow you, if you pledged yourself to Amun!;"Je pense que Seth a pu vous guider jusqu'ici. Le désert l'obéit, vous voyez. Si Seth vous voulait ici, et Khonsu s'est assuré que votre passage en toute sécurité, vous pouvez être sûr que c'était la volonté d'Amon si vous êtes ici. Seulement, il pourrait faire travailler ces deux personnes ensemble !" Le vieil homme en rire.\n[Root.GetFirstName], je crois que vous deviez être ici, maintenant, avec moi ! Si vous le souhaitez, je peux vous apprendre les voies des dieux. La fédération de ma tribu pourrait vous suivre, si vous vous êtes engagé envers Amon !;;;;;;;;;;;;x
egyptian.206.a;Destiny... that must be what I felt!;La destinée ... Ça doit être ça ce que j'ai ressenti !;;;;;;;;;;;;x
egyptian.206.a.tt;You begin your education in earnest...;Vous commencez votre éducation au sérieux ...;;;;;;;;;;;;x
egyptian.206.b;I will not follow your dead gods, old man.;Je ne suivrai pas tes dieux morts, vieillard.;;;;;;;;;;;;x
egyptian.206.b.tt;The rest of your evening is... awkward.;Le reste de votre soirée est ... génante.;;;;;;;;;;;;x
egyptian.207.desc;You've decided to finish your journey, so you can have some closure before entering into the truth that is Kemetism. You've instructed the old man to gather the tribes and come to your capitol in one months time. There will be much work to do before the world bows to the old gods again, and the strength of the faithful will be required...;Vous avez décidé de terminer votre voyage, afin que vous puissiez avoir une certaine fermeture avant d'entrer dans la vérité qui est le Kémitisme. Vous avez demandé au vieil homme de rassembler les tribus et de venir dans votre capitale dans un délai d'un mois. Il y aura beaucoup de travail à faire avant que le monde ne retourne aux anciens dieux, et la force des fidèles sera nécessaire ...;;;;;;;;;;;;x
egyptian.207.a;We have much work to do...;Nous avons beaucoup de travail à faire ...;;;;;;;;;;;;x
egyptian.207.a.tt;With the old man's help, you return to your journey.;Avec l'aide du vieil homme, vous revenez de votre voyage.;;;;;;;;;;;;x
egyptian.208.desc;Despite your unwillingness to convert, the old man helps you find your way to the pilgrim's road. Before long you are back on track.;Malgré votre résistance à vous convertir, le vieil homme vous aide à trouver votre chemin vers la route du pèlerin. Vous êtes de retour sur la bonne voie.;;;;;;;;;;;;x
egyptian.208.a;[Root.Religion.GetHighGodName] tested me this day...;[Root.Religion.GetHighGodName] m'a testé aujourd'hui ...;;;;;;;;;;;;x
egyptian.209.desc;After what seemed like hours, but may well have been just minutes, you practically run into the caravan, spooking a camel. You take your place in the caravan and continue your spiritual journey.;Après ce qui semblait des heures, alors qu'il s'agissait de minutes, vous courrez dans la caravane, effrayant un chameau. Vous prenez votre place dans la caravane et continuez votre voyage spirituel.;;;;;;;;;;;;x
egyptian.209.a;[Root.Religion.GetHighGodName] was with me this night...;[Root.Religion.GetHighGodName] était avec moi cette nuit ...;;;;;;;;;x
egyptian.210.desc;You hear trumpets from the walls, and know whats happening even before the watch captain can tell you. Your new honor guard has arrived. Thousands of warriors on horseback, their spears gleaming in the sun. They are led by three men, each holding a banner with your heraldry topped with a gold ankh.;Vous entendez les trompettes des murs et savez ce qui se passe avant même que le capitaine de la veille ne vous le dise. Votre nouvelle garde d'honneur est arrivée. Des milliers de guerriers à cheval, leurs lances brillantes au soleil. Ils sont dirigés par trois hommes, chacun tenant une bannière avec votre héraldique surmonté d'un ankh en or.;;;;;;;;;;;;;x
egyptian.210.a;Now the work can begin...;Maintenant, le travail peut commencez ...;;;;;;;;;;;;;x
hf.40020.egyptian;[saint_person.GetTitledName] is a well known exemplar of our faith, who recently passed away. Discussions about permanently venerating [saint_person.GetHerHim] as a demigod have come up, but everyone is waiting for my final decision on the matter.;[saint_person.GetTitledName] est un modèle bien connu de notre foi, récemment décédé. Des discussions sur la vénération permanente de [saint_person.GetHerHim] en tant que demi-dieu ont été abordées, mais tout le monde attend ma décision finale à ce sujet.;;;;;;;;;;;;;;x
egyptian_pharaoh_cannonize_choice_TT;[saint_person.GetTitledName]'s funerary cult will get official support, making [saint_person.GetHerHim] a §YDemigod! of the faith. [saint_person.GetHerHisCap] §YDynasty§! would surely appreciate the gesture.;Le culte funéraire de [saint_person.GetTitledName] obtiendra un soutien officiel, faisant de [saint_person.GetHerHim] un §YDemigod! de la foi. [saint_person.GetHerHisCap] §YDynasty§! apprécierait sûrement le geste.;;;;;;;;;;;;;x
###### Chronicle;;;;;;;;;;;;;;x
CHRONICLE_EGYPTIAN_PRIESTHOOD;Backed by [Root.GetTitledName]'s contributions and the growing power of the reborn Kemetic faith, [Prev.GetDynName] was installed as the Paragon Xroj, the first high priest of a new Kemetic era.;Appuyé par les contributions de [Root.GetTitledName] et le pouvoir croissant de la foi Kémite renaissant, [Prev.GetDynName] a été installé en tant que Paragon Xroj, le premier grand prêtre d'une nouvelle ère Kémite. ;;;;;;;;;;;;x
CHRONICLE_ANUBIS_GUARD;Backed by [Root.GetTitledName]'s contributions and the growing power of the reborn Kemetic faith, the Anubis Guard, an order of chariot archers and spears, was established under the command of [Prev.GetDynName].;Appuyé par les contributions de [Root.GetTitledName] et le pouvoir croissant de la foi Kémite renaissant, les gardes d'Anubis, un ordre d'archers et de lances de chariots, a été créé sous le commandement de [Prev.GetDynName].;;;;;;;;;;;;x
CHRONICLE_HORUS_GUARD;Backed by [Root.GetTitledName]'s contributions and the growing power of the reborn Kemetic faith, the Horusian Guard was established under the command of [Prev.GetTitledName].;Appuyé par les contributions de [Root.GetTitledName] et le pouvoir croissant de la foi Kémite renaissant, les gardes d'Horus a été créé sous le commandement de [Prev.GetDynName].;;;;;;;;;;;;x
CHRONICLE_LUXOR_RESTORED;[From.GetTitledName] finished construction on the Grand Temple of Luxor, marshaling in a new age of glory for the Kemetic faith.;[From.GetTitledName] a terminé la construction sur le Grand Temple de Louxor, marquant un nouvel âge de gloire pour la foi Kémite.;;;;;;;;;;;;x
CHRONICLE_ATEN_PRIESTHOOD;On this day, [GetTitledName] declared [GetHerHim]self the Meryaten, high priest of Aten, ushering in a new era of the Most High God.;En ce jour, [GetTitledName] a déclaré lui-même le Meryaten, grand prêtre d'Aten, inaugurant une nouvelle ère du Dieu Très Haut.;;;;;;;;;;;;x
CHRONICLE_BURNING_BLADES;[GetTitledName] organized the Burning Blades, an order of holy warriors in service to the Aten, and led by [Prev.GetTitledName].;[GetTitledName] a mis en place les Lames Brûlantes, un ordre de guerriers saints en service à l'Aton, et dirigé par [Prev.GetTitledName].;;;;;;;;;;;;x
CHRONICLE_AKHETATEN_RESTORED;[From.GetTitledName] finished construction on the Grand Temple of Akhetaten, marshaling in a new age of glory for the Kemetic faith.;[From.GetTitledName] a terminé la construction sur le Grand Temple d'Akhetaton, marquant dans un nouvel âge de gloire pour la foi Kémite.;;;;;;;;;;;;x
###### Aten Events
atenic.0.title;The Restoration of Akhetaten;La restauration d'Akhetaton;;;;;;;;;;;;x
atenic.0.desc;It has been thousands of years since Akhetaten, the great temple city of Aten, was abandoned. But now, you've decided to strike ground at the ancient site and build a new temple complex as a beacon of Aten's faithful.;Depuis des milliers d'années, Akhetaton, la grande ville du temple d'Aton, a été abandonnée. Mais maintenant, vous avez décidé de frapper sol à l'ancien site et de construire un nouveau complexe de temple comme un phare des fidèles d'Aton.;;;;;;;;;;;;x
atenic.0.a;It shall rise from the sands greater than ever!;Il se lèvera des sables plus que jamais !;;;;;;;;;;;;x
atenic.1.title;Expansion;Expansion;;;;;;;;;;;;x
atenic.1.desc;Work in Akhetaten is proceeding well, and your chief architect informs you that the bedrock around the old temple foundation extends farther than originally thought. He wishes to know if you'd like to add another wing to the temple.;Les travaux sur Akhetaton se déroule bien, et votre architecte en chef vous informe que la roche autour de la vieille fondation du temple s'étend plus loin qu'on ne le pensait à l'origine. Il souhaite savoir si vous souhaitez ajouter une autre aile au temple.;;;;;;;;;;;;x
atenic.1.a;Add a great library;Ajouter une grande bibliothèque;;;;;;;;;;;;x
atenic.1.b;Add lodging for fanatics;Ajouter un logement pour les fanatiques;;;;;;;;;;;;x
atenic.1.c;Add an administrative center;Ajouter un centre administratif;;;;;;;;;;;;x
atenic.2.title;Akhetaten Restored;Akhetaton restauré;;;;;;;;;;;;x
atenic.2.desc;The temple of Akhetaten has been restored! Now settlement of the area is underway and a new age for Atenism can begin!;Le temple d'Akhetaton a été restauré ! Maintenant, l'établissement de la région est en cours et un nouvel âge pour l'Atonisme peut commencer !;;;;;;;;;;;;x
atenic.2.a;Glorious!;Glorieux !;;;;;;;;;;;;x
atenic.3.title;Restoration of Akhetaten;La restauration d'Akhetaton;;;;;;;;;;;;x
atenic.3.desc;In the sands of Egypt a new temple to Aten, the sun disc personified, has arisen. Grand in scale and majestic to behold, [From.GetTitledFirstName]'s new temple city of Akhetaten is an impressive sight. Not only is the original sprawling temple complex restored and more glorious than ever, an entirely new wing has been built beyond the old foundations.;Dans les sables d'Égypte, un nouveau temple à Aton, le disque solaire personnifié, est apparu. Immense et majestueux à voir, le nouveau temple d'Akhetaton de [From.GetTitledFirstName] a une vue impressionnante. Non seulement le complexe original du temple a été restauré et plus glorieux que jamais, une aile entièrement nouvelle a été construite au-delà des anciennes fondations.;;;;;;;;;;;;x
atenic.3.a;Glory to the Aten!;Gloire à Aton !;;;;;;;;;;;;x
atenic.3.b;Most troubling...;Inquiétant ...;;;;;;;;;;;;x
atenic.4.title;A New Dawn for Aten;Une nouvelle aube pour Aton;;;;;;;;;;;;x
atenic.4.desc;It has been thousands of years since worship of the Aten has been dominant in Egypt. Now, under the leadership of [Root.GetTitledName] as leader of the restored priesthood, the followers of Aten are ascendant. The people of Egypt will no longer be swayed by false gods, but guided by the light of Aten, the one true god.;Il y a des milliers d'années, le culte d'Aton a dominé l'Égypte. Maintenant, sous la direction de [Root.GetTitledName]  en tant que chef du sacerdoce restauré, les adeptes d'Aton sont plus influant. Le peuple d'Égypte ne sera plus influencé par de faux dieux, mais guidé par la lumière d'Aton, le seul dieu vrai.;;;;;;;;;;;;x
atenic.4.a;Praise Aten!;Gloire à Aton !;;;;;;;;;;;;x
atenic.4.b;Unexpected...;Inattendu ...;;;;;;;;;;;;x
atenic.5.title;Burning Blades;Les Lames Brûlantes;;;;;;;;;;;;x
atenic.5.desc;Rumor has spread of a band of holy warriors who coat there swords in a strange paste and set them on fire before riding into battle, singing praises to Aten. Organized by [GetTitledName] and led by [Prev.GetTitledName], they are sworn to destroy the enemies of the Atenic faith. One would certainly have a large army at their back before challenging these devoted warriors. Or a death wish.;Des rumeurs dissent qu'une bande de guerriers sacrés induisent leurs épées dans une pâte étrange et leurs mettent le feu avant de monter sur les champs de bataille, en chantant des louanges à Aton. Organisé par [GetTitledName] et dirigé par [Prev.GetTitledName], ils ont juré de détruire les ennemis de la foi Aton. Beaucoup de gens voudront certainement avoir une grande armée derrière eux avant de pouvoir les affronter.;;;;;;;;;;;;x
atenic.5.a;Ride, my warriors!;En avant, mes guerriers !;;;;;;;;;;;;x
atenic.5.b;Sounds dangerous...;Ça à l'air dangeureux ...;;;;;;;;;;;;x
