#CELTIC FLAVOR STUFF;;;;;;;;;;;;;;x
hogback_stones_instructions;You have about one year to officially contribute to your father's hogback stone. Succeed and gain the respect of your relatives - fail and earn their distrust and scorn!;Vous avez environ un an pour contribuer officiellement à la pierre de votre père. Réussissez et gagnez le respect de votre famille - échouez et gagnez leur méfiance et leur mépris !;;;;;;;;;;;;x
contribute_to_fathers_hogback_stone;Contribute to Father's Hogback Stone;Contribuez à la pierre Hogback de votre père;;;;;;;;;;;;x
contribute_to_fathers_hogback_stone_desc;Contribute financially to your father's hogback stone - remember you don't have much time left before your relatives look upon you with scorn for failing to honor even your own father!;Contribuez financièrement à la pierre Hogback de votre père. Rappelez-vous que vous n'avez plus beaucoup de temps avant que votre famille ne vous regarde avec mépris pour ne pas avoir honoré votre propre père !;;;;;;;;;;;;x
VIETceltic.12.title;Disappointing Child;Enfant décevant;;;;;;;;;;;;x
VIETceltic.12.desc;My failure to contribute financially to the building of my father's hogback stone is a stain on my honor and reputation. I have disappointed my family. I have disappointed my father. Some say I don't even deserve my position anymore.;Mon incapacité à contribuer financièrement à la construction de la pierre de mon père est une tache sur mon honneur et ma réputation. J'ai déçu ma famille. J'ai déçu mon père. Certains disent que je ne mérite plus ma position.;;;;;;;;;;;;x
VIETceltic.12.a;Hopefully I'll survive this stain on my reputation...;J'espère que je survivrai à cette tache sur ma réputation ...;;;;;;;;;;;;x
VIETceltic.13.desc;Amazing news from [Root.GetName]! A most holy well was discovered there, possessing much spiritual power and capable of performing miracles. Some have claimed they were even healed of various ailments by its great powers. Many people - rich and poor, near and far - are traveling to this location because of this.;Des nouvelles incroyables de [Root.GetName] ! Une fontaine de dévotion a été découvert là-bas, possédant beaucoup de pouvoir spirituel et capable de faire des miracles. Certains ont affirmé qu'ils ont guéris de diverses affections par ses grandes puissances. Beaucoup de gens - riches et pauvres, proches et lointains - voyagent à cet endroit à cause de cela.;;;;;;;;;;;;x
VIETceltic.13.a;Perhaps I should visit this well sometime.;Peut-être que je devrais aller visiter cette fontaine quelquefois.;;;;;;;;;;;;x
VIETceltic.14.desc;The holy well of [Root.GetName] isn't as popular as it once was. A good number of the faithful still claim that it has much spiritual power, but fewer and fewer people are coming to visit it - there are other holy wells, more famous ones, it seems. ;La fontaine de dévotion [Root.GetName] n'est plus aussi populaire d'avant. Un bon nombre de fidèles prétendent encore qu'il a beaucoup de pouvoir spirituel, mais de moins en moins de gens viennent le visiter - il y a d'autres fontaines de dévotion plus célèbres.;;;;;;;;;;;;x
VIETceltic.14.a;What pity that it is now fading into obscurity.;Quel dommage qu'il finisse dans l'oubli.;;;;;;;;;;;;x
VIETceltic.15.desc;Dulcinian;Dolcinien;;;;;;;;;;;;x
VIETceltic.15.a;Dulcinian;Dolcinien;;;;;;;;;;;;x
VIETceltic.20.title;Paying for the Hogback Stones;Payer pour les pierres Hogback;;;;;;;;;;;;x
VIETceltic.20.desc;After meeting with the right people and making the right connections, I believe I have the resources necessary to provide my father with an excellent hogback stone that will sit upon his tomb. He shall be honored greatly, and all will know of the duty I bear to my father.;Après avoir rencontré les bonnes personnes et avoir fait les bonnes relations, je crois que j'ai les ressources nécessaires pour donner à mon père une excellente pierre qui se tiendra sur son tombeau. Il sera grandement honoré, et tous connaîtront le devoir que je porte à mon père.;;;;;;;;;;;;x
VIETceltic.20.a;I will contribute as much as I can!;Je contribuerai autant que possible !;;;;;;;;;;;;x
VIETceltic.20.b;I will contribute a decent amount.;Je vais contribuer un montant décent.;;;;;;;;;;;;x
VIETceltic.20.c;I can only contribute a bit, but I'll contribute nevertheless.;Je ne peux que contribuer un peu, mais je contribuerai néanmoins.;;;;;;;;;;;;x
VIETceltic.21.tooltip;You wait until the stone is finished, and only then will you be able to properly honor your father.;Vous attendez jusqu'à ce que la pierre soit finie, et seulement alors vous pourrez honorer votre père.;;;;;;;;;;;;x
VIETceltic.21.title;Honoring Father;Père honoré;;;;;;;;;;;;x
VIETceltic.21.desc;You watch as the hogback stone is placed upon your father's grave.\n\nYou gaze, face still, face motionless, on your father's final resting place.\n\nYour father. A man you knew quite a bit about, yet there is still much you wished you could have discussed with him. He lived his life, and you will continue to live yours.;Vous regardez que la pierre de la maison soit placée sur la tombe de votre père.\n\nVous regardez, regardez toujours, immobile, sur le dernier lieu de repos de votre père.\n\nVotre père. Un homme dont vous connaissiez un peu, mais il reste encore beaucoup de choses que vous auriez pu discuter avec lui. Il a vécu sa vie, et vous continuerez à vivre le vôtre.;;;;;;;;;;;;x
VIETceltic.21.a;Life moves on, whether we like it or not.;La vie continue, que nous l'aimions ou non.;;;;;;;;;;;;x
VIETceltic.23.desc;Though nominally conquered by the Romans, the Celtiberian peoples have survived in isolated parts of the mountainous regions of northern Iberia. Today, some of them have come to your court, offering their military services. As the Celtiberians descend from a long line of skilled and fearsome warriors, they may prove very useful!;Bien que nominalement conquis par les Romains, les peuples Celtibères ont survécu dans des régions isolées des régions montagneuses du nord de l'Ibérie. Aujourd'hui, certains d'entre eux sont venus à votre cour, offrant leurs services militaires. Comme les Celtibères descendent d'une longue série de guerriers talentueux et redoutables, ils peuvent s'avérer très utiles !;;;;;;;;;;;;x
VIETceltic.23.a;Good! Good!;Bien ! Bien !;;;;;;;;;;;;x
#Tro Breizh;;;;;;;;;;;;;;x
VIETceltic.100.title;Tro Breizh;Tro Breizh;;;;;;;;;;;;x
VIETceltic.100.desc;They say that any Breton who doesn't finish the Tro Breizh pilgrimage will suffer in the afterlife, having to complete it then. It is about time I did this pilgrimage! While it is not as prestigious nor rigorous as traveling to Jerusalem, for instance, it is an important part of our heritage.;On dit que tout Breton qui ne finit pas le pèlerinage de Tro Breizh souffrira dans l'au-delà, il faudra alors le compléter. Il est temps que j'effectue ce pèlerinage ! Bien qu'il ne soit pas aussi prestigieux ni rigoureux que de voyager à Jérusalem, par exemple, c'est une partie importante de notre patrimoine.;;;;;;;;;;;;x
VIETceltic.100.a;I will make the necessary preparations.;Je ferai les préparatifs nécessaires.;;;;;;;;;;;;x
VIETceltic.101.tooltip;A chance to renew myself spiritually, and see all the wonderful sights in our lovely land.;Une chance de me renouveler spirituellement, et de voir tous les sites merveilleux de notre charmante terre.;;;;;;;;;;;;x
VIETceltic.101.title;Touring Brittany;Voyage en Bretagne;;;;;;;;;;;;x
VIETceltic.101.desc;The day has come. It is time to begin the Tro Breizh pilgrimage! I will thus travel to the seven towns of the founding saints of Brittany and gain much piety in doing so.;Le jour est venu. Il est temps de commencer le pèlerinage du Tro Breizh ! Je vais donc voyager dans les sept villes des saints fondateurs de Bretagne et gagner beaucoup de piété pour le faire.;;;;;;;;;;;;x
VIETceltic.101.a;First is Quimper.;D'abord, Quimper.;;;;;;;;;;;;x
VIETceltic.102.tooltip;Let us visit the town of Saint Corentin!;Visitez la ville de Saint Corentin !;;;;;;;;;;;;x
VIETceltic.102.title;Quimper;Quimper;;;;;;;;;;;;x
VIETceltic.102.desc;The rustic town of Quimper isn't as elegant nor extravagant as I would've wished, but it certainly has a certain charm. The conservative folk here are very spiritual, and the religious atmosphere is a good start to my pilgrimage.\n\nI make way to the church of Saint Corentin to pray and reflect. He was the first bishop of this town, and it is said that he had a miraculous fish whose parts would regrow, thus allowing him to sustain himself for as long as he needed.;La ville rustique de Quimper n'est pas aussi élégante ni extravagante que j'aurais souhaité, mais elle a certainement un certain charme. Les gens conservateurs ici sont très spirituels, et l'atmosphère religieuse est un bon début de mon pèlerinage.\n\nJe pars pour la place à l'église de Saint Corentin pour prier et réfléchir. Il était le premier évêque de cette ville, et on dit qu'il avait un poisson miraculeux dont les parties repoussaient, ce qui lui permettait de se maintenir pendant aussi longtemps qu'il en avait besoin.;;;;;;;;;;;;x
VIETceltic.102.a;That makes me hungry!;Ça me donne faim !;;;;;;;;;;;;x
VIETceltic.103.tooltip;But first I must pray first before I leave Quimpur, for tomorrow I head for Saint-Pol-de-Léon.;Mais d'abord, je dois prier avant de quitter Quimper, car demain je me dirige vers Saint-Pol-de-Léon.;;;;;;;;;;;;x
VIETceltic.103.tooltip.3;But first I must pray first before I leave Quimpur, for tomorrow I head for Saint-Pol-de-Léon.;Mais d'abord, je dois prier avant de quitter Quimper, car demain je me dirige vers Saint-Pol-de-Léon.;;;;;;;;;;;;x
VIETceltic.103.title;Saint-Pol-de-Léon;Saint-Pol-de-Léon;;;;;;;;;;;;x
VIETceltic.103.desc;Saint-Pol-de-Léon is a lovely seaside town blessed with picturesque beaches and the refreshing ocean air. There are an unusual amount of vegetables and fruits being so, which is unsurprising giving the stories surrounding Saint Paul Aurelian, the great saint of this town.\nIt is here where Saint Paul Aurelian established an important monastery. He had an interesting habit of refusing to eat meat, and is said to have lived to almost a century and a half.;Saint-Pol-de-Léon est une belle ville balnéaire bénie avec des plages pittoresques et l'air rafraîchissant de l'océan. Il y a une quantité inhabituelle de légumes et de fruits, ce qui n'est pas surprenant en écoutant les histoires entourant Saint Pol Aurélien, le grand saint de cette ville.\nC'est ici où Saint Pol Aurélien a établi un monastère important. Il avait une habitude intéressante de refuser de manger de la viande, et il aurait vécu jusqu'à presque un siècle et demi.;;;;;;;;;;;;x
VIETceltic.103.a;To live that long and be able to do so much!;Pour vivre aussi longtemps et être en mesure de le faire bien !;;;;;;;;;;;;x
VIETceltic.104.tooltip;Our next stop is Tréguier.;Notre prochain arrêt est Tréguier;;;;;;;;;;;;x
VIETceltic.104.title;Tréguier;Tréguier;;;;;;;;;;;;x
VIETceltic.104.desc;Tréguier is a seaside town like Saint-Pol-de-Léon but it is much busier. An important local port, it is often busy with commerce and trade. Perhaps not always the best fit for a more contemplative, religious experience, but who am I to say that?\n\nTréguier is the town of Saint Tudwal, a renowned hermit and monastic, who was later made bishop of this town.;Tréguier est une ville balnéaire comme Saint-Pol-de-Léon mais elle est beaucoup plus occupée. Un port local important, il est souvent occupé par le commerce et le commerce. Peut-être n'est-il pas toujours le meilleur pour une expérience religieuse plus contemplative, mais qui suis-je pour dire cela ?\n\nTréguier est la ville de Saint Tugdual, un ermite renommé et monastique, devenu évêque de cette ville.;;;;;;;;;;;;x
VIETceltic.104.a;I must show his patience, as I wade through the throngs of pilgrims.;Je dois montrer ma patience étant donné que j'avance péniblement à travers la foule des pèlerins.;;;;;;;;;;;;x
VIETceltic.105.tooltip;After this, we will go to Saint-Brieuc;Après cela, nous irons à Saint-Brieuc;;;;;;;;;;;;x
VIETceltic.105.title;Saint-Brieuc;Saint-Brieuc;;;;;;;;;;;;x
VIETceltic.105.desc;Now I am at Saint-Brieuc, yet another harbor town. I am a bit tired of the busy towns I've recently come, and thankfully Saint-Brieuc offers refuge in its natural bay, a large reserve of green scenery against the blue waters below. As the locals told me, I can even see and hear hundreds and thousands of birds here, flourishing in this holy site.\n\nHere is also the town of the great Saint Brioc, who founded the monastery that this town revolves around. I am lucky to be in the oratory he established, where it can lend myself to quiet prayer.;Maintenant, je suis à Saint-Brieuc, encore une ville portuaire. Je suis un peu fatigué des villes occupées que je viens récemment, et heureusement Saint-Brieuc offre refuge dans sa baie naturelle, une grande réserve de paysage verdoyant contre les eaux bleues. Comme les gens du coin me l'ont dit, je peux même voir et entendre des centaines et des milliers d'oiseaux ici, florissant dans ce site sacré.\n\nVoici aussi la ville du grand Saint Brieuc, qui a fondé le monastère que cette ville entour. Je suis chanceux d'être dans l'oratoire qu'il a établi, où je peux faire une prière tranquille.;;;;;;;;;;;;x
VIETceltic.105.a;A holy place indeed!;Un lieu saint en effet !;;;;;;;;;;;;x
VIETceltic.106.tooltip;My next destination is Saint-Malo.;Ma prochaine destination est Saint-Malo.;;;;;;;;;;;;x
VIETceltic.106.title;Saint-Malo;Saint-Malo;;;;;;;;;;;;x
VIETceltic.106.desc;I was a bit apprehensive about going to Saint-Malo at first. It is known as a rough neighborhood, where dwell pirates, rowdy seamen, and fearsome adventurers. But I realize this is only one part of the town - there are also normal people who live here, with good Christian virtue, despite (or maybe because of) their surroundings.\n\nSaint-Malo's patron, Saint Malo, perhaps fits this town to some extent. A disciple of Saint Brendan (so I am told), he was said to have traveled and adventured the high seas with his master, reaching a mysterious land called the Blessed Isles.;J'étais un peu inquiet d'aller à Saint-Malo au début. Il est connu que se trouve dans les parages des pirates, des marins chahuteurs et des aventuriers redoutables. Mais je me rends compte que ce n'est que ça ne fait qu'une partie de la ville - il y a aussi des gens normaux qui vivent ici, avec une bonne vertu chrétienne, malgré (ou peut-être à cause de) leur environnement.\n\nLe patron de Saint-Malo, Saint Maclou, a fondé cette ville dans une certaine mesure. C'était un disciple de saint Brendan (à ce qu'on dit), il aurait voyagé et aventuré la haute mer avec son maître, atteignant une terre mystérieuse appelée les îles bénies.;;;;;;;;;;;;x
VIETceltic.106.a;I wonder what heathens he converted on those isles?;Je me demande quels païens il a converti sur ces îles ?;;;;;;;;;;;;x
VIETceltic.107.tooltip;Once we are done here, onwards to Dol!;Une fois qu'on aura fini ici, en route pour Dol-de-Bretagne !;;;;;;;;;;;;x
VIETceltic.107.title;Dol;Dol-de-Bretagne;;;;;;;;;;;;x
VIETceltic.107.desc;Dol is a place filled with history. I heard it was here, for instance, that Saint Teilo was assigned by King Budric to slay a fearsome dragon that had terrorized the locals. How I wish I were there to see that battle! It must have been quite a spectacle, holy saint against evil dragon.\n\nIt was also here that Saint Teilo and Saint Dol planted the fruit groves that remain to this day. As I stroll under these trees, I cannot but help feel at ease in the midst of nature, God's creation.;Dol-de-Bretagne est un lieu rempli d'histoire. J'ai entendu dire que c'était ici, par exemple, que Saint-Samson était assigné par le roi Budric pour tuer un dragon redoutable qui avait terrorisé les habitants. Comme je souhaiterais être là pour voir cette bataille ! Quel spectacle ça a dû être, un saint contre un dragon maléfique.\n\nIl était également quand Saint Théleau et lui ont planté des fruitiers qui sont toujours là. En me promenant sous ces arbres, je ne peux m'empêcher de me sentir à l'aise au milieu de la nature, la création de Dieu.;;;;;;;;;;;;x
VIETceltic.107.a;Not to mention the fruit they bear is delicious.;Sans parler des fruits qu'ils portent, c'est délicieux.;;;;;;;;;;;;x
VIETceltic.108.tooltip;Our journey is almost over - one last stop, in Vannes.;Notre voyage est presque terminé : un dernier arrêt à Vannes.;;;;;;;;;;;;x
VIETceltic.108.title;Vannes;Vannes;;;;;;;;;;;;x
VIETceltic.108.desc;I am almost finished with the Tro Breizh, for I now arrive in Vannes, the seventh and last stop on this pilgrimage. It is, despite being a very ancient settlement - dating from before the Roman Emperors, the learned men tell me - very joyous and exciting. I found, for example, much amusement in the comically puffy, ugly granite statues the locals dub "Vannes and his Wife."\n\nBut this is a time for religion, not mirth. I reflect on the saint of Vannes, Saint Patern. He was, in fact, a contemporary of the mighty King Arthur, the great hero, who tamed the king's avarice and humbled the monarch.;J'ai presque terminé le Tro Breizh, car j'arrive maintenant à Vannes, la septième et dernière étape de ce pèlerinage. C'est, en dépit d'être un établissement très ancien - datant d'avant les empereurs romains, que les savants me racontent des histoires - très joyeusement et passionnément. Je trouvais, par exemple, beaucoup d'amusement dans les statues de granit comiques, moches appelé "Vannes et sa femme".\n\nMais c'est le moment pour la religion, plus à la joie. Je réfléchis sur le saint de Vannes, Saint Patern. Il était, en fait, un contemporain du puissant roi Arthur, le grand héros, qui domptait l'avarice du roi et humiliait le monarque.;;;;;;;;;;;;x
VIETceltic.108.a;I too, must practice the virtues. This is why I went on this pilgrimage after all.;Moi aussi, je dois être vertueux. C'est pourquoi je suis parti en pèlerinage après tout.;;;;;;;;;;;;x
VIETceltic.109.tooltip;My journey is almost over.;Mon voyage est sur le point de se terminer.;;;;;;;;;;;;x
VIETceltic.109.title;Completing the Tro Breizh;Achever le Tro Breizh;;;;;;;;;;;;x
VIETceltic.109.desc;My old residence looms on the horizon. I am home, having finished the Tro Breizh, a duty all Bretons must follow undoubtedly. I have reflected on much through this pilgrimage, and seen the spiritual wonders of our land, our religious heritage.;Ma vieille résidence se profile à l'horizon. Je suis à la maison, après avoir terminé le Tro Breizh, un devoir que tous les Bretons doivent suivre sans aucun doute. J'ai réfléchi beaucoup à travers ce pèlerinage, et j'ai vu les merveilles spirituelles de notre terre, notre héritage religieux.;;;;;;;;;;;;x
VIETceltic.109.a;May I remember what I've experienced for as long as live.;Puis-je me rappeler ce que j'ai vécu aussi longtemps que je puisse vivre.;;;;;;;;;;;;x
VIETceltic.150.desc;I long for a quaint, warm festivity, in contrast to the formal, extravagant ones I am used to. This year, I will ensure that our parish's Gwyl Mabsant is even better than the last!;Je désire une fête pittoresque et chaleureuse, contrairement aux formels, extravagants auxquels je suis habitué. Cette année, je vais assurer que Gwyl Mabsant de notre paroisse soit encore meilleur que le dernier !;;;;;;;;;;;;x
VIETceltic.150.a;We will start organizing with local leaders.;Nous allons commencer à organiser avec les chefs locaux.;;;;;;;;;;;;x
VIETceltic.151.tooltip;This is going to be fun!;Cela va être amusant !;;;;;;;;;;;;x
VIETceltic.151.desc;The Gwyl Mabsant has begun. Though everyone looks forward to the rowdy, fun activities, we must first attend church. Each locality celebrates Gwyl Mabsant to honor its patron saint, and today is no different. We are serene and reflective as the clergy sing special psalms, and teach us of faith and virtue.;Le Gwyl Mabsant a commencé. Bien que tout le monde s'attend à des activités fougueuses et amusantes, nous devons d'abord aller à l'église. Chaque localité célèbre Gwyl Mabsant pour honorer son saint patron et aujourd'hui n'est pas différent. Nous sommes sereins et réfléchis alors que le clergé chante des psaumes spéciaux et nous enseigne la foi et la vertu.;;;;;;;;;;;;x
VIETceltic.151.a;But after this, the fun begins!;Mais après ça, la fête peut commencer !;;;;;;;;;;;;x
VIETceltic.152.tooltip;There will be a lot of things to do.;Il y aura beaucoup de choses à faire.;;;;;;;;;;;;x
VIETceltic.152.desc;The fun has begun! There is always so much to see and do at Gwyl Mabsant. I could try to participate in one of the competitions myself, or perhaps watch from afar.;La fête a commencé ! Il y a toujours tellement de choses à voir et à faire à Gwyl Mabsant. Je pourrais essayer de participer à l'une des compétitions moi-même, ou peut-être de regarder de loin.;;;;;;;;;;;;x
VIETceltic.152.a;Either way, I'm going to have a great time either way.;Quoi qu'il en soit, je vais passer un bon moment dans tout les cas.;;;;;;;;;;;;x
VIETceltic.153.tooltip;Let's see... what to do first?;Voyons ... Que faire en premier ?;;;;;;;;;;;;x
VIETceltic.153.desc;The cockowners place their cocks on the ground, and set them loose. The audience - myself included - cheers and applauds as the two creatures scratch and bite each other. I'm certainly rooting for that one to win...;Les propriétaires de coq placent leurs animaux sur le sol et les relâchent. Le public - moi inclus - appuie et applaudit alors que les deux créatures se grattent et se mordent. Je suis certain de prier pour celui qui va gagner ...;;;;;;;;;;;;x
VIETceltic.153.a;The stronger looking one. Might makes right!;Le plus fort. Peut-être bien !;;;;;;;;;;;;x
VIETceltic.153.b;The weaker one. I always like seeing good underdog succeed.;Le plus faible. J'aime toujours voir le succès de la victime.;;;;;;;;;;;;x
VIETceltic.154.tooltip;Let's see... what to do first?;Voyons ... Que faire en premier ?;;;;;;;;;;;;x
VIETceltic.154.desc;Hurrah! My bando team scored a goal. Amazing, how these villagers have trained to use long wooden sticks to strike at goalposts many yards away. It's even more fun to see when bando players hit each other with their sticks - it's almost like jousting, or sparring, except even more intense. No wonder its one of the most popular events at Gwyl Mabsant.;Hourra ! Mon équipe de bando a marqué un but. Incroyable, comment ces villageois ont été formés pour utiliser de longs bâtonnets en bois pour frapper à des pistes à plusieurs mètres de là. Il est encore plus amusant de voir quand les joueurs de bando se frappent avec leurs bâtons - c'est presque comme une joute ou un combat, mais en encore plus intense. Pas étonnant que ce soit l'un des événements les plus populaires à Gwyl Mabsant.;;;;;;;;;;;;x
VIETceltic.154.a;Haha! Another goal for us!;Haha ! Encore un autre but pour nous !;;;;;;;;;;;;x
VIETceltic.155.tooltip;Let's see... what to do first?;Voyons ... Que faire en premier ?;;;;;;;;;;;;x
VIETceltic.155.desc;At Gwyl Mabsant, everyone is in mirthful mood. People often drink and sing and dance, and why shouldn't I partake in such festivity?;A Gwyl Mabsant, tout le monde a l'air joyeux. Les gens boivent, chantent et dansent souvent, et pourquoi ne pas participer à une telle fête ?;;;;;;;;;;;;x
VIETceltic.155.a;I'm uninterested. This is a holy day, not an opportunity for sin!;Je ne suis pas intéressé. C'est un jour saint, pas une opportunité pour le pêché !;;;;;;;;;;;;x
VIETceltic.155.b;I will drink, and drink 'till I can drink no more!;Je boirais et boirais jusqu'à ce que je ne puisse plus boire !;;;;;;;;;;;;x
VIETceltic.155.c;Song! There is nothing like that. It lifts the soul yet enlivens the spirit.;Chanson ! Il n'y a rien de tel. Il élève l'âme vivifie encore l'esprit.;;;;;;;;;;;;x
VIETceltic.155.d;Dancing is quite a joy - especially when I get to meet interesting people.;Danser avec joie - surtout quand je rencontre des gens intéressants.;;;;;;;;;;;;x
VIETceltic.155.e;I don't wish to join in, not that I'm against it.;Je ne veux pas participer, pas que je suis contre.;;;;;;;;;;;;x
wtf_am_i_at_gwyl;Now I have to wonder why I'm here in the first place...;Maintenant, je me demande pourquoi je suis ici en premier lieu ...;;;;;;;;;;;;x
VIETceltic.156.tooltip;Let's see... what to do first?;Voyons ... Que faire en premier ?;;;;;;;;;;;;x
VIETceltic.156.desc;At Gwyl Mabsant, one of the more fascinating events are the grinning matches between old women. I don't often see too many elderly peasant women, so it's quite a sight to see!;A Gwyl Mabsant, l'un des événements les plus fascinants sont les matchs de grimaces entre les femmes âgées. Je ne vois pas trop de paysannes âgées, donc c'est une chose à voir !;;;;;;;;;;;;x
VIETceltic.156.a;I'm still not entirely sure on the rules, though...;Je ne suis toujours pas tout à fait sûr des règles, cependant ...;;;;;;;;;;;;x
VIETceltic.157.tooltip;Let's see... what to do first?;Voyons ... Que faire en premier ?;;;;;;;;;;;;x
VIETceltic.157.desc;Racing wheelbarrows blindfolded! Now this is one of the more exciting events at Gwyl Mabsant.;Des brouettes de course avec les yeux bandés ! C'est l'un des événements les plus passionnants de Gwyl Mabsant.;;;;;;;;;;;;x
VIETceltic.157.a;I'll partake in the race myself!;Je vais participer à la course moi-même !;;;;;;;;;;;;x
VIETceltic.157.b;I think it's safer to watch - fun, yes, but not the safest.;Je pense qu'il est plus sûr de regarder - amusez-vous, oui, mais pas sans danger.;;;;;;;;;;;;x
VIETceltic.158.tooltip;Let's see... what to do first?;Voyons ... Que faire en premier ?;;;;;;;;;;;;x
