#CELTIC FLAVOR STUFF;;;;;;;;;;;;;;x
VIETceltic.158.desc;One of the things I look most forward to at Gwyl Mabsant is the hot pudding. Being of high status I always have access to the finest custards and similar sweets, but there's nothing like homemade pudding from the locals.;Une des choses que je regarde le plus dans le Gwyl Mabsant est le boudin chaud. Étant d'un statut élevé, j'ai toujours accès aux meilleures crèmes anglaises et aux bonbons, mais il n'y a rien de mieux que le pudding fait maison des habitants.;;;;;;;;;;;;x
VIETceltic.158.a;I will indulge in good food!;Je me livrerai à la bonne nourriture !;;;;;;;;;;;;x
VIETceltic.159.desc;Several days of fun have passed, and the locals are either going home or lying around drunk. This year's Gwyl Mabsant has been wonderful, and I don't think we will see another one like this for years.;Plusieurs jours d'amusement sont passés, et les gens du pays sont soit à la maison, soit soûle. Le Gwyl Mabsant de cette année a été merveilleux, et je ne pense pas que nous allons voir un autre comme ça pendant des années.;;;;;;;;;;;;x
VIETceltic.159.a;And now I leave this simple, fun world.;Et maintenant, je laisse ce monde simple et amusant.;;;;;;;;;;;;x
VIETceltic.160.tooltip;Dulcinian;Dolcinien;;;;;;;;;;;;x
VIETceltic.160.desc;Dulcinian;Dolcinien;;;;;;;;;;;;x
VIETceltic.160.a;Dulcinian;Dolcinien;;;;;;;;;;;;x
go_to_obby_oss;Go to 'Obby 'Ossy festival;Aller au festival d'Obby 'Oss;;;;;;;;;;;;x
go_to_obby_oss_desc;Every year in May, Padstow celebrates the 'Obby 'Oss festival. Maybe this year I should attend?;Chaque année en mai, Padstow célèbre le festival d'Obby' Oss. Peut-être que cette année je devrais y assister ?;;;;;;;;;;;;x
VIETceltic.200.desc;I have decided to visit Padstow this May for the 'Obby 'Oss festival. Regardless of wether I dress up as the Oss, flee from it or simply sit by the sidelines, I can look foward to a fun time and lots of celebration!;J'ai décidé de visiter Padstow en ce mois de mai pour le festival d'Obby' Oss. Indépendamment de moi, je m'habille comme Oss, que se soi fuir ou s’asseoir sur les marches, Je peux prendre un petit moment de plaisir et m'amuser beaucoup !;;;;;;;;;;;;x
VIETceltic.200.a;I can't wait for 'Obby 'Oss to begin!;Je ne peux pas attendre que l'Obby 'Oss commence !;;;;;;;;;;;;x
cant_wait_for_obby_oss;You make preparations to travel to Padstow;Vous vous préparez pour voyager à Padstow;;;;;;;;;;;;x
VIETceltic.201.name;Welcome To Padstow;Bienvenue à Padstow;;;;;;;;;;;;x
VIETceltic.201.desc;After some slow and tedious travelling, you and your entourage finally set sight on the small town of Padstow. The town would be like any other in Cornwall, were it not for his (in)famous reputation for hosting the yearly 'Obby 'Oss festival, which attracts not only visitors but also merchants from all around, who come peddle their wares to revellers who are having too much fun to notice the price hike. As you enter the town, the mood is festive and joyous and many people are already tipsy despite it being barely past midday. Many cheers are given to celebrate your arrival as you ride across the gates - 'Long live [Root.Liege.GetTitledFirstName]! Welcome to Padstow your lordship!';Après un long et fastidieux voyage, vous et votre entourage êtes finalement arrivé à la ville de Padstow. La ville pourrait être n'importe quelle autres villes de Cornouailles, si ce n'était pour sa réputation célèbre d'accueillir le festival annuel d'Obby 'Oss, qui attire non seulement les visiteurs, mais aussi les marchands de tous les coins, qui vendent leurs marchandises aux fêtards qui sont trop amusé pour remarquer la hausse des prix. Lorsque vous entrez dans la ville, l'ambiance est festive et joyeuse et beaucoup de gens sont déjà soûle même si on n'est que midi. Beaucoup d'encouragements sont donnés pour célébrer votre arrivée lorsque vous roulez en traversant les portes d'entrée - 'Longue vie à [Root.Liege.GetTitledFirstName] ! Bienvenue à Padstow, mon seigneur !';;;;;;;;;;;;x
VIETceltic.201.a;Yes thank you! Now, when do we start?;Oui, merci ! Quand est-ce qu'on commence ?;;;;;;;;;;;;x
VIETceltic.202.name;An 'Ossy Proposal;Une proposition d'Ossy;;;;;;;;;;;;x
VIETceltic.202.desc;As you approach the town hall you are greeted by the town mayor and the master of ceremonies, who these days is as much an authority as the head of town. They great you with food and refreshment for you and your entourage and inform you that preparations are under way to make these an 'Obby 'Oss to remember. There is only one last question: Would you like to be given the honor of being this year's Old 'Oss, don the 'Oss's costume and chase young maidens all day lol?;En vous approchant de l’hôtel de ville, vous êtes salués par le maire de la ville et le maitre des cérémonies, qui a aujourd'hui la même autorité que le maire. Ils vous accueillent avec de la bonne nourriture et des rafraîchissements et votre entourage et vous informe que des préparatifs sont en cours pour l'Obby 'Oss. Il n'y a qu'une dernière question : voulez-vous qu'on lui donne l'honneur d'être l'ancien 'Oss de cette année, de faire le costume d’Oss et de chasser les jeunes filles toute la journée ? (lol);;;;;;;;;;;;x
VIETceltic.202.a;Chase around... Do you even need to ask?;Chassez des ... Pourquoi demandez ?!;;;;;;;;;;;;x
VIETceltic.202.b;Actually, this year I'll pass...;Je passe pour cette année ...;;;;;;;;;;;;x
VIETceltic.203.name;The 'Ossy Chase;La chasse de l'Ossy;;;;;;;;;;;;x
VIETceltic.203.desc;As you approach the town hall you are greeted by the town mayor and the master of ceremonies, who these days is as much an authority as the head of town. They great you with food and refreshment for you and your entourage and inform you that preparations are under way to make these an 'Obby 'Oss to remember. There is only one last question: When the Old 'Oss starts chasing women across town, do you wish to be considered fair game?;En vous approchant de l'hôtel de ville, vous êtes salués par le maire de la ville et le maitre des cérémonies, qui a aujourd'hui la même autorité que le maire. Ils vous accueillent avec de la bonne nourriture et des rafraîchissements et votre entourage et vous informe que des préparatifs sont en cours pour l'Obby 'Oss. Il n'y a qu'une dernière question : lorsque l'ancien 'Oss commence à chasser des femmes à travers la ville, souhaitez-vous être considéré comme une participante ?;;;;;;;;;;;;x
VIETceltic.203.a;Of course! Let the 'Oss come!;Bien sûr ! Laissez l'Oss venir !;;;;;;;;;;;;x
VIETceltic.203.b;I think I'll enjoy it from a distance.;Je pense que je vais en profiter à distance.;;;;;;;;;;;;x
VIETceltic.204.name;You Are The Old 'Oss;Vous êtes l'ancien 'Oss;;;;;;;;;;;;x
VIETceltic.204.desc;In the early morning, you make your way to the Old 'Oss's 'stable' (The Golden Lion Inn) and with the help of two acolytes don the large mask and huge black cape supported by a frame. You psyche yourself as the stable doors are swung open to a wave of cheers, drums and flutes. While you can't see much with the mask on you can hear many girls challenging you 'Here Ossy! Here Ossy' Accompanied by your hecklers, you set out to grab the women. Every woman you manage to drag under you cape will be blessed and be pregnant within a year.;Au début de la matinée, vous ouvrez le chemin de l'Établissement de l'ancien Oss (L'auberge du lion d'or) et, avec l'aide de deux acolytes, donnez le grand masque et la grande cape noire soutenue par un cadre. Vous poussez voir la grande porte s'ouvrir et vous sentez une vague d'acclamations, de tambours et de flûtes. Bien que vous ne puissiez pas voir beaucoup de chose avec le masque, vous pouvez entendre de nombreuses filles vous défier 'Par ici, 'Ossy ! Par ici !' Accompagné par des sifflements et vous prenez l'envie d'attraper toutes les femmes. Toute femme que vous parvenez à traîner sous votre cap sera bénie et sera enceinte pendant un an.;;;;;;;;;;;;x
VIETceltic.204.a;Come at me beauties!;Par ici mes beautés !;;;;;;;;;;;;x
VIETceltic.205.name;The Old 'Oss Approaches!;Le vieux 'Oss approche !;;;;;;;;;;;;x
VIETceltic.205.desc;In the morning, as you descend from your quarters in comfortable white clothes adored with red stripes hanging from your waist, as tradition demands, you come across a lively scene as the townspeople prepare for the Old 'Oss to leave his stable in the inn. To the distress and discomfort of your guards, you merge and mingle with the large group of women when the doors of the inn swing open and the Old Oss emerges from the inside, accompanied from his hecklers. Despite being almost unable to see, the Oss begins chasing the women to the sound of laugher, drums and flutes. Every girl he drags under his large cape is promised to be blessed with child within the year.;Dans la matinée, lorsque vous descendez de votre quartier dans des vêtements blancs confortables adorés de rayures rouges accrochées à votre taille, comme la tradition l'exige, vous rencontrez une scène animée alors que les habitantes de la ville se préparent à l'ancien Oss pour quitter son écurie dans l'auberge. À la détresse et à l'inconfort de vos gardes, vous fusionnez et mélangez avec le grand groupe de femmes lorsque les portes de l'auberge s'ouvrent et que l'Ancien Oss émerge de l'intérieur, accompagné de ses chiens. En dépit d'être presque incapable de voir, l'Oss commence à chasser les femmes au son des rires, des tambours et des flûtes. Chaque fille qu'il traîne sous sa grande cape est promis d'être béni avec un enfant dans l'année.;;;;;;;;;;;;x
VIETceltic.205.a;Here Ossy! Here Ossy!;Par ici l'Ossy ! Par ici !;;;;;;;;;;;;x
VIETceltic.206.name;Padstow goes silent;Padstow deviens silencieuse;;;;;;;;;;;;x
VIETceltic.206.desc;As they say, all good things must come to an end. The Old 'Oss is tired and has returned to his stable where it will stay until next year, most of the food and drinks have been consumed and the merchants are starting to pack their wares as the 'Obby 'Oss draws to a close. In the evening, all the townspeople gather by the Maypole to drink and sing songs welcoming the Summer as the countdown to the next 'Obby 'Oss begins.;Comme ils le disent, toutes bonnes choses doivent prendre fin. Le vieux 'Oss est fatigué et est revenu à son écurie où il restera jusqu'à l'année prochaine, la plupart des aliments et des boissons ont été consommés et les marchands commencent à emballer leurs marchandises alors que l'Obby 'Oss s'achève. Dans la soirée, toutes les citadines se rassemblent à l'Arbre de mai pour boire et chanter des chansons accueillant l'été, alors que le compte à rebours du prochain 'Obby 'Oss commence.;;;;;;;;;;;;x
VIETceltic.206.a;I can't wait for my next 'Obby 'Ossy!;Je ne peux pas attendre le prochain 'Obby 'Ossy !;;;;;;;;;;;;x
VIETceltic.207.desc;Under the heavy black cape and mask of the Old 'Oss, it's hard to make out who or what is right in front of you, but it is still relatively easy to make out the distinct giggles of a maiden in front of you. When you reach with your arms in front and through the cape, you catch a young peasant girl and proceed to drag her as she lets out a mix of laughter and screaming until only her feet are visible from outside the cape.;Sous la lourde cape noire et le masque du vieux 'Oss, il est difficile de déterminer qui ou ce qui se passe juste devant vous, mais il est encore relativement facile d'entendre les rires d'une jeune fille devant vous. Lorsque vous tendez vos bras à travers la cape, vous attrapez une jeune paysanne et vous la faites glisser alors qu'elle lâche un mélange de rires et de cris jusqu'à ce que ses pieds ne soient visibles depuis l'extérieur du cap.;;;;;;;;;;;;x
VIETceltic.207.a;The blessing of the Old 'Oss is yours!;La bénédiction du vieux 'Oss est en toi !;;;;;;;;;;;;x
bless_ya_girl;You bless the young girl;Vous bénissez la jeune fille;;;;;;;;;;;;x
VIETceltic.207.b;How about a bit of sweetness for the Ossy?;Que diriez-vous de la douceur de la part du Ossy ?;;;;;;;;;;;;x
steal_a_kiss;You get a kiss! Whooo!;Vous l'embrassez ! Whaou !;;;;;;;;;;;;x
VIETceltic.207.c;I can make sure the blessing happens later tonight...;Je peux m'assurer que la bénédiction arrive plus tard ce soir ...;;;;;;;;;;;;x
obby_ossy_bunga_bunga;You enjoy the Obby Ossy... alot.;Vous aimez être le vieux 'Oss ... beaucoup.;;;;;;;;;;;;x
VIETceltic.208.desc;Under the heavy black cape and mask of the Old 'Oss, it's hard to make out who or what is right in front of you, but it is still relatively easy to make out the distinct giggles of a maiden in front of you. When you reach with your arms in front and through the cape, you catch one of your female courtiers and proceed to drag her inside your cape until only her feet are visible from the outside.;Sous la lourde cape noire et le masque du vieux 'Oss, il est difficile de déterminer qui ou ce qui se passe juste devant vous, mais il est encore relativement facile d'entendre les rires d'une jeune fille devant vous. Lorsque vous tendez vos bras à travers la cape, vous attrapez une de vos courtisanes et vous la faites glisser alors qu'elle lâche un mélange de rires et de cris jusqu'à ce que ses pieds ne soient visibles depuis l'extérieur du cap.;;;;;;;;;;;;x
VIETceltic.208.a;The blessing of the Old 'Oss is yours!;La bénédiction du vieux 'Oss est en toi !;;;;;;;;;;;;x
VIETceltic.208.b;How about a bit of sweetness for the Ossy?;Que diriez-vous de la douceur de la part du Ossy ?;;;;;;;;;;;;x
VIETceltic.209.desc;Under the heavy black cape and mask of the Old 'Oss, it's hard to make out who or what is right in front of you, but it is still relatively easy to make out the distinct giggles of a maiden in front of you. When you reach with your arms in front and through the cape, you catch a courtier, someone who you feel some affection for and for whom you believe the feeling is mutual. Under the cape of the 'Oss you are suddenly away from prying eyes...;Sous la lourde cape noire et le masque du vieux 'Oss, il est difficile de déterminer qui ou ce qui se passe juste devant vous, mais il est encore relativement facile d'entendre les rires d'une jeune fille devant vous. Lorsque vous tendez vos bras à travers la cape, vous attrapez une de vos courtisanes, quelqu'un dont vous ressentez de l'affection et pour qui vous croyez que le sentiment est mutuel. Sous le cap de l'Oss, vous vous éloigné des regards indiscrets ...;;;;;;;;;;;;x
VIETceltic.209.a;How fortunate that I caught you milady...;Quelle chance que je vous ai attrapée, ma dame ...;;;;;;;;;;;;x
VIETceltic.209.b;Oh huh... You're blessed by the Old 'Oss!;Og heu ... Vous êtes béni par le vieux 'Oss;;;;;;;;;;;;x
VIETceltic.210.desc;Being the Old 'Oss is not the easiest job out there. The cape and mask are heavy and black, which traps the heat inside, also visibility is pretty terrible. In an honest mistake you think you hear a maiden in front of you and lunge forward, only to find yourself dragging a young child, who is clearly scared of the Oss's grotesque figure.;Être l'ancien 'Oss n'est pas le travail le plus simple. a cape et le masque sont lourds et noirs, qui piègent la chaleur à l'intérieur, la visibilité est plutôt terrible. Dans une erreur honnête, vous pensez entendre une jeune fille en face de vous et vous lancez en avant, seulement pour vous retrouver en traînant une jeune enfant, qui a clairement peur de la figure grotesque de 'Oss.;;;;;;;;;;;;x
VIETceltic.210.a;Pat the child on the head and send her on her way.;Vous vous excusez et vous laissez la gamine.;;;;;;;;;;;;x
VIETceltic.210.b;To little girls, the Ossy brings treats!;Le vieux 'Oss va bénir aussi les petites filles !;;;;;;;;;;;;x
VIETceltic.211.desc;Being the Old 'Oss is not the easiest job out there. The cape and mask are heavy and black, which traps the heat inside, also visibility is pretty terrible. In an honest mistake you think you hear a maiden in front of you and lunge forward only to find yourself dragging a man under the cape, clearly upset by jeer, while the townsfolk's laughter has grown tenfold with the mixup;Être l'ancien 'Oss n'est pas le travail le plus simple. a cape et le masque sont lourds et noirs, qui piègent la chaleur à l'intérieur, la visibilité est plutôt terrible. Dans une erreur honnête, vous pensez entendre une jeune fille en face de vous et vous lancer en avant, seulement pour vous retrouver en traînant un homme, manifestement bouleversé par le rire, alors que le rire des citadins s'est multiplié par dix avec le mélange.;;;;;;;;;;;;x
VIETceltic.211.a;Scold him for impersonating a woman!;Le grondez pour avoir fait croire que c'était une femme !;;;;;;;;;;;;x
VIETceltic.211.b;Be festive and laugh it all off.;Être festif et rire aussi.;;;;;;;;;;;;x
VIETceltic.211.c;Throw him into the horse's water, let the people laugh!;Vous le lancez dans l'eau du cheval et vous laissez les gens rire !;;;;;;;;;;;;x
VIETceltic.2112.desc;Being the Old 'Oss is more than simply chasing girls and follow the parade, as it involves being the center of attention and the embodiment of 'Obby 'Oss fun. As you arrive at the Maypole, right at the center of town, the townspeople start demanding that you dance a jig with one of the damsels..;Être l'ancien 'Oss ne consiste pas seulement à chasser de jeunes femmes et suivre le défilé, car il s'agit d'être le centre d'attention et l'incarnation de l'amusement de l'Obby 'Oss. Lorsque vous arrivez à l'arbre de mai, au centre de la ville, les citadins commencent à exiger que vous dansez un gabarit avec une des demoiselles.;;;;;;;;;;;;x
VIETceltic.2112.a;Good thing I'm in my dancing shoes!;Bien, je suis dans mes chaussures de danse !;;;;;;;;;;;;x
VIETceltic.2112.b;Er.... no.;Euh ... Non.;;;;;;;;;;;;x
VIETceltic.212.desc;There's no way around the fact that the frame of the 'Oss is heavy and cumbersome, but with a nice display of tap dancing, together with some jumping and spinning, you do more than fine. Luckily your dancing partner is helpful and enhances your dance as the revellers clap and ask for more.;Il n'y a aucun moyen de dire que le cadre de l'Oss est lourd et encombrant, mais avec une belle représentation de la danse du robinet, avec un saut et une rotation, vous le faites plus que bien. Heureusement, votre partenaire de danse est utile et améliore votre danse alors que les fêtards applaudissent et en demandent encore.;;;;;;;;;;;;x
VIETceltic.212.a;I'll need a beer after this, or two...;J'aurai besoin d'une bière après cela, ou deux ...;;;;;;;;;;;;x
VIETceltic.213.desc;There's no way around the fact that the frame of the 'Oss is heavy and cumbersome and that certainly affects performance. You try to do some tap dancing and spinning, but unfortunately you trip and fall, having to rely on your dancing partner to get yourself (and the frame) up. You sigh as the cheers have turned to laughter.;Il n'y a aucun moyen de dire que le cadre de l'Oss est lourd et encombrant et qui affecte certainement les performances. Vous essayez de faire des claquettes et la filature, mais malheureusement, vous trébucher et tomber, vous devez compter sur votre partenaire de danse pour vous se préoccuper de vous. Vous soupirez quand les acclamations se sont tournées vers le rire.;;;;;;;;;;;;x
VIETceltic.213.a;I'd like to see you all do better!;J'aimerais vous vous voir !;;;;;;;;;;;;x
VIETceltic.214.desc;While I know there are lots of people around me, inside the Old 'Oss's mask and covered by the cape, it's actually quiet and secluded, and I can talk to the 'Ossy in piece, and it talks to me. It tells me I need to have more fun, more drinks, more of everything, otherwise he'll be sad!;Même si je sais qu'il y a beaucoup de gens autour de moi, à l'intérieur du masque du vieux 'Oss et couvert d'une cape, il est en fait calme et isolé, et je peux parler à l'Oss, et il me parle. Il me dit que je dois avoir plus de plaisir, plus de boissons, plus de tout, sinon il sera triste !;;;;;;;;;;;;x
VIETceltic.214.a;No 'Ossy, don't be sad!;Non Ossy, ne sois pas triste !;;;;;;;;;;;;x
VIETceltic.215.desc;While getting caught is part of the fun, you don't want to make it too easy, so you heckle the 'Oss and clap but retreat if he lunges at you. Finally after some time of this game you aren't fast enough and get grabbed and dragged into the Old 'Oss's cape, where a kind young man helps you on your feet.;Pendant que vous preniez plaisir, vous ne voulez pas vous faire prendre facilement, mais il vous remarque et vous courrez. Après un certain temps, vous n'êtes pas assez rapide et vous êtes attiré et traîné dans la cape de l'ancien 'Oss, où un gentil jeune homme traîne vos pieds.;;;;;;;;;;;;x
VIETceltic.215.a;Act graciously.;Agir gracieusement.;;;;;;;;;;;;x
VIETceltic.215.b;Make a big fuss.;Faire un gros bruit.;;;;;;;;;;;;x
VIETceltic.216.desc;While getting caught is part of the fun, you don't want to make it too easy, so you heckle the 'Oss and clap but retreat if he lunges at you. Finally after some time of this game you aren't fast enough and get grabbed and dragged into the Old 'Oss's cape where a young man who clearly had too much to drink already tries to grab you and demands a kiss!;Pendant que vous preniez plaisir, vous ne voulez pas vous faire prendre facilement, mais il vous remarque et vous courrez. Après un certain temps, vous n'êtes pas assez rapide et vous êtes attiré et traîné dans la cape de l'ancien 'Oss, où un gentil jeune homme traîne vos pieds et exige de vous un bisou !;;;;;;;;;;;;x
VIETceltic.216.a;Overpower him quietly.;Le dominer rapidement;;;;;;;;;;;;x
VIETceltic.216.b;Coach him into  being more gentle.;Entraînez-le à devenir plus doux.;;;;;;;;;;;;x
VIETceltic.216.c;Give him what he wants.;Lui donner ce qu'il veut.;;;;;;;;;;;;x
VIETceltic.216.d;Make a fuss and kick him into the ground!;Mettez-lui un coup de pied dans les burnes !;;;;;;;;;;;;x
VIETceltic.217.desc;Some would say the Old 'Oss is supposed to be the embodiment of fun and hedonism, but even then there are limits. The 'Oss dragged a girl into it cape and while it's impossible to see what's happening inside, the sounds make it clear she's struggling. Some of the townspeople are becoming restless... Maybe it's time to put an end to this?;Certains diraient que l'ancien 'Oss est censé être l'incarnation de l'amusement et de l'hédonisme, mais il y a des limites quand même. L'Oss a traîné une fille dans la cape et, alors qu'il est impossible de voir ce qui se passe à l'intérieur, les sons indiquent qu'elle se débat. Certaines personnes de la ville s’inquiètent ... Peut-être qu'il est temps de mettre fin à cela ?;;;;;;;;;;;;x
VIETceltic.217.a;You! Unhand that girl!;Vous ! Enlevez vos mains sur cette fille !;;;;;;;;;;;;x
VIETceltic.217.b;It's all fun and games...;Ce n'est qu'un jeu ...;;;;;;;;;;;;x
VIETceltic.218.desc;Before the startled eyes of the townspeople you pull up the 'Oss's cape to find a most sordid scene as the young maiden tries to struggle with the man playing the 'Oss attempts to undress her. The townspeople boo as the guards push the man inside a house, strip him of his suit and arrest him. Not before long a new man is playing the 'Oss and many cheers are given to you.;Tous les habitants de la ville ont les yeux rivés sur vous, vous tirez la cape d'Oss pour trouver une scène la plus sordide alors que la jeune fille essaye de lutter avec l'homme qui a joué l'Oss. Les citadines s'habillent alors que les gardes poussent l'homme à l'intérieur d'une maison, l'arrachent à son costume et l'arrêtent. Pas longtemps, un nouvel homme joue le 'Oss et beaucoup de salutations vous sont données.;;;;;;;;;;;;x
VIETceltic.218.a;No means no.;Non, c'est non.;;;;;;;;;;;;x
VIETceltic.219.desc;Before the startled eyes of the townspeople you pull up the 'Oss's cape to find the two innocently flirting until you startle them. The girl rushes outside the cape as the man proceeds in playing the 'Oss. You return to the crowd somewhat embarrassed as you hear whispers around you.;Tous les habitants de la ville ont les yeux rivés sur vous, vous tirez la cape d'Oss pour trouver deux personnes flirter innocemment jusqu'à ce que vous les arrêtiez. La fille se précipite à l'extérieur de la cape de l'homme qui joue l'Oss. Vous revenez à la foule un peu embarrassé alors que vous entendrez des chuchotements autour de vous.;;;;;;;;;;;;x
VIETceltic.219.a;Better safe than sorry...;Mieux vaut prévenir que guérir ...;;;;;;;;;;;;x
VIETceltic.220.desc;You patiently wait for the girl to get out from under the cape but she tarries. Suddenly her legs start twitching and two men rush to see what's going on, only to find the girl half naked and struggling. A mob quickly surrounds the 'Oss and the mood sours, even after the person playing the part is switched.;Vous attendez patiemment que la fille se calme. Mais soudainement, ses jambes commencent à se tordre et un homme se précipite pour voir ce qui se passe, seulement pour trouver la fille à moitié nue et en lutte. Deux soldats l'attrapent rapidement et l'arrête et est vite remplacé et la fête continue.;;;;;;;;;;;;x
VIETceltic.220.a;I was just about to intervene!;J'étais sur le point d'intervenir !;;;;;;;;;;;;x
VIETceltic.221.desc;After a minute you and some of the townspeople start feeling nervous about what's happening under the cape, but it all goes well when the girl emerges from under the cape, giggling frantically. What happened no-one can tell, but it the church most likely wouldn't like it...;Au bout d'une minute, vous et certains habitants de la ville commencent à se sentir nerveux à propos de ce qui se passe sous la cape, mais tout se passe bien quand la fille sort de la cape en riant frénétiquement. Ce qui s'est passé, personne ne peut le dire, mais l'église ne l'aimerait probablement pas ...;;;;;;;;;;;;x
