#CELTIC FLAVOR STUFF;;;;;;;;;;;;;;x
VIETceltic.221.a;I knew nothing bad could happen!;Je savais qu'il ne se passait rien de mal !;;;;;;;;;;;;x
VIETceltic.222.desc;Some would say the Old 'Oss is supposed to be the embodiment of fun and hedonism, but even then there are limits. The 'Oss dragged a courtier under its cape and while it's impossible to see what's happening inside, the sounds make it clear she's struggling. Some of the townspeople are becoming restless... Maybe it's time to put an end to this?;Certains diraient que l'ancien 'Oss est censé être l'incarnation de l'amusement et de l'hédonisme, mais il y a des limites quand même. L'Oss a traîné une courtisane dans la cape et, alors qu'il est impossible de voir ce qui se passe à l'intérieur, les sons indiquent qu'elle se débat. Certaines personnes de la ville s’inquiètent ... Peut-être qu'il est temps de mettre fin à cela ?;;;;;;;;;;;;x
VIETceltic.222.a;You! Unhand that girl!;Vous ! Enlevez vos mains sur cette fille !;;;;;;;;;;;;x
VIETceltic.222.b;Cheer her on from the outside.;Faites l'éloge de l'extérieur.;;;;;;;;;;;;x
VIETceltic.223.desc;As the procession arrives at the Maypole, right at the center of town, the townspeople start demanding that the Oss dances a jig with one of the women. Being a guest of honor, the 'Oss is quick to challenge you to a tap dance as the townspeople start applauding and cheering you on.;À mesure que la procession arrive à l'arbre de mai, au centre de la ville, les habitants de la ville commencent à exiger que l'Oss danse un gabarit avec une des femmes. En tant qu'homme d'honneur, l'Oss est prompt à vous défier à une danse au robinet alors que les citadins commencent à vous applaudir et à vous encourager.;;;;;;;;;;;;x
VIETceltic.223.a;I'll shame the 'Oss with my dance moves!;Je ferais fonte à l'Oss avec mes mouvements de danse !;;;;;;;;;;;;x
VIETceltic.223.b;I... maybe another time.;Je ... Peut-être une autre fois.;;;;;;;;;;;;x
VIETceltic.224.desc;Using grace and skill, you impress commoner and noble-born alike with your dance. You dance enthusiastically and energetically as the onlookers cheer you and toast to you, while even the 'Oss struggles to keep up.;En utilisant vos grâces et vos compétences, vous impressionnez les gens ordinaires et les nobles avec votre danse. Vous dansez de façon enthousiaste et énergique alors que les spectateurs vous encouragent, même si l'Oss s'efforce de vous suivre.;;;;;;;;;;;;x
VIETceltic.224.a;This is fun!;C'est amusant !;;;;;;;;;;;;x
VIETceltic.225.desc;Alas, some people are just not born a dancer, and certainly the drink is not a good enhancement in the struggle to keep balance. You give it your best shot but your clunky moves fail to impress anyone but the drunkards and the 'Oss quickly changes partner in the least offensive way possible.;Hélas, certaines personnes ne sont tous né danseur, et la boisson n'aide certainement. Vous lui montrez vos meilleurs mouvements, mais vous n'impressionnez que les ivrognes et les 'Oss changent rapidement de partenaire de manière à moins vous offensez.;;;;;;;;;;;;x
VIETceltic.225.a;I can still rule better than all of you!;Je sais encore mieux gouverner que vous tous !;;;;;;;;;;;;x
VIETceltic.226.desc;You take another sip of your drink and turn to talk to someone when you notice... everyone's gone! A thick mist surrounds Padstow as you struggle to see anything until you notice something in front of you, a rider, with a black cape, on a horse... A BLACK RIDER!;Vous prenez une autre gorgée de votre boisson et vous vous tournez pour parler à quelqu'un quand vous remarquez que ... tout le monde est parti ! Un brouillard épais entoure Padstow alors que vous avez du mal à voir n'importe quoi jusqu'à ce que vous remarquiez quelque chose en face de vous, un cavalier, avec une cape noire, à cheval ... UN CAVALIER NOIR !;;;;;;;;;;;;x
VIETceltic.226.a;Sound the alarm! The dark knights come!;Sonnez l'alarme ! Les chevaliers noirs arrivent !;;;;;;;;;;;;x
VIETceltic.227.desc;Everything is dark when you hear your guards call out to you. As you open your eyes you find yourself lying on the floor as many onlookers surround you. You also notice your so called 'black rider', the 'Oss itself. Your guards inform you that you started screaming about black riders before fainting.;Tout est sombre lorsque vous entendez vos gardes vous appeler. Au fur et à mesure que vous ouvrez les yeux, vous vous trouvez au sol avec beaucoup de spectateurs qui vous entourent. Vous remarquez également votre soi-disant "cavalier noir" est l'Oss lui-même. Vos gardes vous informent que vous avez commencé à crier au sujet de chevaliers noirs avant de vous évanouir.;;;;;;;;;;;;x
VIETceltic.227.a;Huh, it seems the black rider fled, good!;Huh, on dirait les cavaliers noirs se sont enfuits, bien !;;;;;;;;;;;;x
VIETceltic.228.desc;Here me people of Padstow! This whole celebration is the work of THE DEVIL and pagan gods who seek to corrupt your souls!! We must atone and bun this false idol of a horse that you worship!' One of your religious minded courtiers apparently came to Padstow to do something other than partying...;"Oyez, peuple de Padstow ! Toute cette célébration est l'œuvre DU MALIN et des dieux païens qui cherchent à corrompre vos âmes !! Nous devons expier et cracher cette fausse idole d'un cheval que vous adorerez !" Un de vos courtisans d'esprit religieux est venu à Padstow pour faire autre chose que la fête ...;;;;;;;;;;;;x
VIETceltic.228.a;Someone shut up that oaf?;Quelqu'un peut-il lui faire fermer sa gueule ?;;;;;;;;;;;;x
VIETceltic.228.b;Maybe next year we can have the Abstinence 'Oss?;Peut-être que l'année prochaine, nous pouvions ne pas organiser l'Oss ?;;;;;;;;;;;;x
VIETceltic.229.desc;You watch the shenanigans of the Old 'Oss parade unfold from a distance when [Root.Spouse.GetFirstName] invites you for a dance to the sound of the music being played.;Vous regardez les combines du défilé du vieux 'Oss se dérouler à distance lorsque [Root.Spouse.GetFirstName] vous invite à une danse au son de la musique jouée.;;;;;;;;;;;;x
VIETceltic.229.a;Of course! What's a party without dancing?;Bien sûr ! Que serait une fête sans une danse ?;;;;;;;;;;;;x
VIETceltic.229.b;Not now! The Old 'Oss just caught someone!;Pas maintenant ! Le vieux 'Oss viens d'attraper quelqu'un !;;;;;;;;;;;;x
VIETceltic.230.desc;With the grace of a sovereign and the energy of a true child of old Britain, you impress your spouse with your skillful dancing ability. Many other noble onlookers also take note of your performance.;Avec la grâce d'un souverain et l'énergie d'un véritable enfant de l'ancienne Bretagne, vous impressionnez votre conjoint(e) avec votre capacité de danse habile. Beaucoup d'autres spectateurs nobles prennent également note de votre performance.;;;;;;;;;;;;x
VIETceltic.230.a;We should have a contest where famous nobles can dance and... no?;Nous devrions avoir un concours où les nobles célèbres peuvent danser et ... non ?;;;;;;;;;;;;x
VIETceltic.231.desc;Alas, some people are just not born a dancer, and certainly the drink is not a good enhancement in the struggle to keep balance. You give it your best shot but your clunky moves fail to impress anyone and you stop the dance as people start whispering around you.;Hélas, certaines personnes ne sont tous né danseur, et la boisson n'aide certainement. Vous lui montrez vos meilleurs mouvements, mais vous n'impressionnez que les ivrognes et pendant que vous arrêtez de danser, vous commencez à entendre des gens chuchoter derrière vous.;;;;;;;;;;;;x
VIETceltic.231.a;I can still rule better than all of you!;Je sais encore mieux gouverner que vous tous !;;;;;;;;;;;;x
VIETceltic.232.desc;You browse through the merchant's stalls when one of them tries to sell you some squab pie, a local delicacy.;Vous parcourez les stands des marchands lorsque l'un d'entre eux vous attrape et essaye de vous vendre une tarte au pigeonneau, une délicatesse locale.;;;;;;;;;;;;x
VIETceltic.232.a;I'll buy some.;J'en achèterai un peu.;;;;;;;;;;;;x
VIETceltic.232.b;I'm cornish, of course I know squab pie!;Je suis cornouaillais, bien sûr que je connais la tarte aux pigeonneaux !;;;;;;;;;;;;x
VIETceltic.232.c;I don't know... I'll accept a taste.;Je ne sais pas ... J'accepte de gouter.;;;;;;;;;;;;x
VIETceltic.232.d;Squab? Isn't that a pigeon?;Aux pigeonneaux ? N'est-ce pas du pigeon ?;;;;;;;;;;;;x
VIETceltic.233.desc;You are alone at night when you hear a commotion outside. Fearing bandits you immediately fetch the closest weapon and prepare for the whatever may come when you see a tall monster approaching from outside the fence, accompanied by men wielding torches!;Vous êtes seul la nuit lorsque vous entendez une agitation dehors. Craignant les bandits, vous prenez immédiatement l'arme la plus proche et vous vous préparez pour ce que cela peut être lorsque vous voyez un grand monstre s'approcher de l'extérieur de la clôture, accompagné d'hommes brandissant des torches !;;;;;;;;;;;;x
VIETceltic.233.a;What in heaven's name?...;Nom de Dieu ? ...;;;;;;;;;;;;x
VIETceltic.234.desc;As the monster comes closer you're put at ease as it's nothing but a crowd of chanters with a Mari Lwyd! As per tradition they start chanting outside your door, in the hope of gaining entrance and receiving food and refreshment.;Au fur et à mesure que le monstre se rapproche, vous vous rendez compte qu'il ne s'agit que d'une foule de chanteurs accompagné de Mari Lwyd ! Selon la tradition, ils commencent à chanter à l'extérieur de votre porte, dans l'espoir d'entrer et de recevoir de la nourriture et du rafraîchissement.;;;;;;;;;;;;x
VIETceltic.234.a;Quick! Prepare a small feast to welcome them!;Vite ! Préparez une petite fête pour les accueillir !;;;;;;;;;;;;x
VIETceltic.234.b;Give them some food and send them on their way.;Donnez-leur de la nourriture et renvoyez-les.;;;;;;;;;;;;x
VIETceltic.234.c;They may still be bandits...;Ça pourrait être des bandits ...;;;;;;;;;;;;x
#Knights of Le Round Table, Excalibur, Mordred, etc.;;;;;;;;;;;;;;x
VIETceltic.500.desc;As tales of my mighty deeds as a Knight of the Round Table spread around the realm and beyond, many are comparing to the greatest Arthurian knight, Sir Lancelot! They say few can match me in valor and chivalry.;En tant que contes de mes puissantes actions en tant que chevalier de la table ronde s'étendant autour du royaume et au-delà, beaucoup vous compare au plus grand chevalier Arthurien, Sir Lancelot ! Ils disent que peu peuvent me faire face en courage et en chevalerie.;;;;;;;;;;;;x
VIETceltic.500.a;I feel quite good about myself.;Je suis sûr de moi-même;;;;;;;;;;;;x
VIETceltic.501.desc;[From.GetTitledFirstName]’s deeds and reputation as a mighty member of the Knights of the Round Table are known to all Some are making comparisons with the legendary Sir Lancelot.;Les actes et la réputation de [From.GetTitledFirstName] en tant que membre puissant des Chevaliers de la Table ronde sont connus de tous. Certains font des comparaisons avec le légendaire Sir Lancelot.;;;;;;;;;;;;x
VIETceltic.501.a;I see. May this new Lancelot accomplish great and noble deeds.;Je vois. Que ce nouveau Lancelot accomplisse de grands et nobles actes.;;;;;;;;;;;;x
VIETceltic.501.b;I am happy for our knight. However, I'd... keep my wife away, though, just in case.;Je suis heureux pour notre chevalier. Cependant, je voudrais ... garder ma femme loin de lui, au cas où.;;;;;;;;;;;;x
VIETceltic.502.desc;Some admire my apparent innocence and sweetness. Being a Knight of the Round Table, a comparison with Sir Perceval is unsurprising. Was there any other knight more innocent than he?;Certains admirent mon apparence d'innocence et de douceur. Étant chevalier de la table ronde, une comparaison avec Sir Perceval n'est pas surprenante. Est-ce qu'il y avait un autre chevalier plus innocent que lui ?;;;;;;;;;;;;x
VIETceltic.502.a;So I am like Sir Perceval...;Ainsi je suis Sir Perceval ...;;;;;;;;;;;;x
VIETceltic.503.desc;[From.GetTitledFirstName] is gaining a reputation for embodying the personality and attributes of one of the Knights of the Round Table, Sir Perceval. Like Sir Perceval, [From.GetTitledFirstName] often displays an innocent and sweet personality.;[From.GetTitledFirstName]a gagné une réputation pour incarner la personnalité et les attributs de l'un des Chevaliers de la Table Ronde, Sir Perceval. Comme Sir Perceval, [From.GetTitledFirstName] affiche souvent une personnalité innocente et douce.;;;;;;;;;;;;x
VIETceltic.503.a;Certainly there is much to be proud of.;Certes, il y a beaucoup à être fiers.;;;;;;;;;;;;x
VIETceltic.504.desc;Sir Gawain was one of the mightiest of King Arthur’s knights. As a member of the Round Table, people are now drawing comparisons between me and Sir Gawain.;Sir Gauvain était l'un des plus puissants des chevaliers du roi Arthur. En tant que membre de la Table ronde, les gens établissent maintenant des comparaisons entre moi et Sir Gauvain.;;;;;;;;;;;;x
VIETceltic.504.a;How flattering!;Comme c'est flatteur !;;;;;;;;;;;;x
VIETceltic.505.desc;They say [From.GetTitledFirstName] bears a lot of similarities to Sir Gawain. Both, as members of the Round Table, are generally courteous and compassionate, protectors of fair maidens, and are formidable warriors as well.;On dit que [From.GetTitledFirstName] a beaucoup de similitudes avec Sir Gauvain. Tout deux, en tant que membres de la Table ronde, sont généralement courtois et compatissants, protecteurs de bonnes filles, et font aussi des guerriers formidables.;;;;;;;;;;;;x
VIETceltic.505.a;I see! Good to hear.;Je vois ! C'est bon à entendre.;;;;;;;;;;;;x
VIETceltic.506.desc;They say I am virtuous and gallant, a pure and noble knight beyond compare. In fact, they say I am like Sir Galahad of old Arthurian legend. I am merely another Knight of the Round Table, and cannot accept such a lofty comparison, however.;On dit que je suis vertueux et galant, un chevalier pur et noble, au-delà de la comparaison. En fait, ils disent que je suis comme Sir Galaad de la vieille légende d'Arthur. Je ne suis qu'un autre chevalier de la table ronde, et je ne peux pas accepter une comparaison aussi élevée.;;;;;;;;;;;;x
VIETceltic.506.a;But people will think and say what they will!;Mais les gens vont penser et dire ce qu'ils vont faire !;;;;;;;;;;;;x
VIETceltic.507.desc;A lot of people are comparing [From.GetTitledFirstName], a member of your Knights of the Round Table, with Sir Galahad, the legendary knight of King Arthur who obtained the Holy Grail and was so virtuous that he ascended straight to heaven.;Beaucoup de gens comparent [From.GetTitledFirstName], un membre de vos Chevaliers de la Table ronde, avec Sir Galaad, le chevalier légendaire du roi Arthur qui a obtenu le Saint Graal et était si vertueux qu'il est monté directement au ciel.;;;;;;;;;;;;x
VIETceltic.507.a;Have I no knight more pure?;Suis-je un chevalier pur ?;;;;;;;;;;;;x
VIETceltic.508.desc;Last night after the feast I got really drunk, and only vaguely remember sleeping with a beautiful woman. As I reflect on the wonderful experience, I slowly realize to my horror that that woman was no other than my own sister! This is exactly like what happened with King Arthur and his sister Morgause. What have I done!;La nuit dernière après la fête, j'étais vraiment soûle, et je me souviens vaguement de dormir avec une belle femme. Alors que je réfléchis sur l'expérience merveilleuse, je me rends compte lentement que cette femme n'était autre que ma propre sœur ! C'est exactement ce qui s'est passé avec le roi Arthur et sa sœur Morgause. Qu'est-ce que j'ai fait ?;;;;;;;;;;;;x
VIETceltic.508.a;We must not speak of this ever again. Never.;Nous ne devons plus en parler. Jamais.;;;;;;;;;;;;x
VIETceltic.508.b;But… now that I think about it… it wasn’t that bad, right?;Mais ... maintenant que j'y pense à ça ... ce n'était pas si grave, n'est-ce pas ?;;;;;;;;;;;;x
VIET_mordred_incest_nay;Heavens forbid she is pregnant with a traitor like Mordred!;Les cieux interdisent qu'elle soit enceinte d'un traître comme Mordred !;;;;;;;;;;;;x
VIET_mordred_incest_yay;Let’s just hope she won’t get pregnant with a traitor like Mordred. In the while, dear sister, I’d like to invite you somewhere nice...;Espérons qu'elle ne sera pas enceinte d'un traître comme Mordred. Pendant ce temps, chère sœur, j'aimerais vous inviter quelque part ...;;;;;;;;;;;;x
VIETceltic.510.desc;My unholy union with my sibling has resulted in the birth of a son, [From.GetTitledFirstName]. Unfortunately, everyone knows the unusual circumstances of his birth, with some saying the parallels between my new son and the legendary Mordred are alarming. I only hope that he will not grow up to be like that ungrateful traitor.;Mon union impie avec mon frère a entraîné la naissance d'un fils, [From.GetTitledFirstName]. Malheureusement, tout le monde connaît les circonstances inhabituelles de sa naissance, certains disent que les parallèles entre mon nouveau fils et le Mordred légendaire sont alarmants. J'espère seulement qu'il ne grandira pas pour être comme un traître ingrat.;;;;;;;;;;;;x
VIETceltic.510.a;What have I done?;Qu'est-ce que j'ai fait ?;;;;;;;;;;;;x
VIETceltic.511.desc;My unholy union with my sibling has resulted in the birth of a daughter, [From.GetTitledFirstName]. Unfortunately, everyone knows the unusual circumstances of his birth. Though the circumstances of my little girl’s birth is similar to that of the legendary Mordred, she is, thankfully, a girl.;Mon union impie avec mon frère a entraîné la naissance d'une fille, [From.GetTitledFirstName]. Malheureusement, tout le monde connaît les circonstances inhabituelles de sa naissance. Bien que les circonstances de la naissance de ma petite fille soient semblables à celles du légendaire Mordred, c'est, heureusement, une fille.;;;;;;;;;;;;x
VIETceltic.511.a;Hopefully… she’s just a girl, it can’t be that bad, right?;Espérons que ... C'est juste une fille, ça ne peut pas être si grave, n'est-ce pas ?;;;;;;;;;;;;x
VIETceltic.512.desc;I don’t know why people look at me strangely. Some people say I should be a monster because of my mommy and daddy! Why? I never did anything wrong. Who cares. I’ll be smarter, stronger, and better than them one day. Then they won’t make fun of me anymore.;Je ne sais pas pourquoi les gens me regardent étrangement. Certaines personnes disent que je devrais être un monstre à cause de ma maman et mon papa ! Pourquoi ? Je n'ai rien fait de mal. On s'en fout. Je serai plus intelligent, plus fort et mieux qu'un jour. Ensuite, ils ne se moqueront plus de moi.;;;;;;;;;;;;x
VIETceltic.512.a;That’s right!;C'est vrai !;;;;;;;;;;;;x
VIETceltic.513.desc;My little [From.GetTitledFirstName] is growing up well despite the unusual circumstances of his birth. They say he is quite a capable boy, who has skills in swordsmanship and horseback riding unmatched among his peers. He also seems to display unnatural intelligence and cunning.;Mon petit [From.GetTitledFirstName] a bien grandi malgré les circonstances inhabituelles de sa naissance. Ils disent qu'il est un garçon assez capable, qui a des compétences en espadonnerie et équitation sans égal parmi ses pairs. Il semble également montrer une intelligence et une ruse non naturelle.;;;;;;;;;;;;x
VIETceltic.513.a;That’s my boy!;C'est mon garçon !;;;;;;;;;;;;x
VIETceltic.513.b;I find this worrying…;C'est inquiétant ...;;;;;;;;;;;;x
VIETceltic.514.desc;My little [From.GetTitledFirstName] is growing up well despite the unusual circumstances of her birth. They say she is quite a strong girl, who has learned how to wield sword and master horsemanship, besting many of the boys her age. She also seems to display unnatural intelligence and cunning.;Ma petite [From.GetTitledFirstName] a bien grandi malgré les circonstances inhabituelles de sa naissance. Ils disent qu'elle est une fille assez forte, qui a appris à brandir l'épée et maîtriser l'équitation, en battant beaucoup de garçons de son âge. Elle semble aussi montrer une intelligence et une ruse non naturelle.;;;;;;;;;;;;x
VIETceltic.514.a;That’s my girl!;C'est ma fille !;;;;;;;;;;;;x
VIETceltic.514.b;I find this worrying…;C'est inquiétant ...;;;;;;;;;;;;x
VIETceltic.515.desc;It can’t be! It just can’t be! But… it makes so much sense! I’ve finally learned why all these years people have been mocking me, cruelly scorning me. My father and mother were siblings, and I am the child of their unholy union. People look down on me just because of my parents’ sins!;C'est impossible ... C'est impossible ! Mais ... ça a beaucoup de sens ! J'ai finalement appris pourquoi toutes ces années, les gens se moquaient de moi et se moquait de moi cruellement. Mon père et ma mère étaient des frères et sœurs, et je suis l'enfant de leur union impie. Les gens me regardent juste à cause des péchés de mes parents !;;;;;;;;;;;;x
VIETceltic.515.a;I hate you mom! I hate you dad!;Je te hais maman ! Je te hais papa !;;;;;;;;;;;;x
VIETceltic.516.desc;[From.GetTitledFirstName] has recently learned about the unusual circumstances of [From.GetHerHis] birth. The child has confronted you about this, and though you tried to answer diplomatically, your attempts only frustrated and upset [From.GetHerHim] even more. [From.GetSheHeCap] eventually stormed away, fuming and enraged, ranting and raving.;[From.GetTitledFirstName] a récemment appris les circonstances inhabituelles de sa naissance. L'enfant vous a confronté à ce sujet, et bien que vous ayez essayé de répondre diplomatiquement, vos tentatives ne sont que frustration et bouleversement. [From.GetSheHeCap] est finalement sorti irrité et enragé.;;;;;;;;;;;;x
VIETceltic.516.a;I have a bad feeling about this.;J'ai un mauvais préssentiment.;;;;;;;;;;;;x
VIETceltic.517.desc;Sir Mordred was the traitorous enemy of King Arthur, a despised villain and murderous lout. Yet why do people compare me to this evil man? Simply because I have flaws, and because I am not on best terms with the King of Britain? This is not flattering at all!;Sir Mordred était l'ennemi traître du roi Arthur, un méchant méprisé et un mortel assassiné. Pourtant, pourquoi les gens me comparent-ils à cet homme méchant ? Tout simplement parce que j'ai des défauts, et parce que je ne suis pas dans les meilleurs termes avec le roi de Bretagne ? Ce n'est pas flatteur du tout !;;;;;;;;;;;;x
VIETceltic.517.a;How dare they!;Comment osent-ils ?;;;;;;;;;;;;x
VIETceltic.518.desc;Everybody knows you don’t have the best relationship with [From.GetTitledFirstName], who is considered by [From.GetHerHis] enemies and rivals to be a rather villainous character. In fact, some have compared [From.GetHerHim] to Mordred, the legendary brute and scoundrel who betrayed Arthur!;Tout le monde sait que vous n'avez pas la meilleure des relations avec [From.GetTitledFirstName], qui est considéré par [From.GetHerHis] comme des ennemis et des rivaux comme un personnage plutôt méchant. En fait, certains ont comparé [From.GetHerHim] à Mordred, la légendaire brute et le scélérat qui a trahi Arthur !;;;;;;;;;;;;x
VIETceltic.518.a;He is a villain, and deserves such a reputation!;Il est un méchant, et mérite une telle réputation !;;;;;;;;;;;;x
VIETceltic.518.b;This child of mine is trouble indeed!;Cet enfant est vraiment ennuyeux !;;;;;;;;;;;;x
VIETceltic.519.desc;A most curious man has visited you! A Moor, he claims to be the illegitimate son of one of your lesser knights who died a while back, conceived when this knight traveled to the land of the Mohammedans and had a short affair with a local noblewoman. Wishing to emulate the deeds of King Arthur’s Moorish knight, Morien, he will serve you with great loyalty.;Un homme très curieux vous a rendu une visite ! Un Maure, il prétend être le fils illégitime de l'un de vos  chevaliers qui sont mort depuis longtemps, conçus lorsque ce chevalier se rendit dans la terre des Mahométisme et rencontra une petite femme noble du coin. Désireux d'imiter les actes du chevalier maure du roi Arthur, Morien, il vous servira avec une grande loyauté.;;;;;;;;;;;;x
VIETceltic.519.a;He is welcome at my court.;Il est le bienvenu à ma cour.;;;;;;;;;;;;x
VIETceltic.520.desc;While traveling, you come to a forest. There’s something different about it… something bewitching.;En voyageant, vous entrez dans une forêt. Il y a quelque chose de différent ... quelque chose d'envoûtant.;;;;;;;;;;;;x
VIETceltic.520.a;I wonder why this forest feels so special?;Je me demande pourquoi cette forêt est si spéciale ?;;;;;;;;;;;;x
VIETceltic.521.tooltip;You explore the forest for a bit.;Vous explorez un peu la forêt.;;;;;;;;;;;;x
VIETceltic.521.title;Excalibur;Excalibur;;;;;;;;;;;;x
